,TweetSentence,annotation,calai_candidates,entry_batch,hashtags,phase1Candidates,ritter_candidates,sentID,stanford_candidates,start_time,tweetID,user
0,We all must RT so that they getbthe message we want them held responsible!,[],,12.0,,,,0,,2019-02-16 18:12:51.630076,36000,royalsoda1
1,Chemical Massacre by the  in,[],,12.0,"wagthedog, TheResistance, Impeachtrump, Germany, Trump, USA, FALLUJAH",nan,,0,,2019-02-16 18:12:51.630699,36001,anoncdn
2,kick @POTUS @ivankatrump out of @WhiteHouse,[],,12.0,,,,0,,2019-02-16 18:12:51.630975,36002,HollywoodDebi
3,we did NOT ELECT this woman,[],,12.0,,ELECT::*3*||,,1,,2019-02-16 18:12:51.630975,36002,HollywoodDebi
4,& she is making EXECUTIVE DECISIONS?,[],,12.0,,EXECUTIVE DECISIONS::*4*5*||,,2,,2019-02-16 18:12:51.630975,36002,HollywoodDebi
5,@REALdonaldtrump = a,[],,12.0,,,,3,,2019-02-16 18:12:51.630975,36002,HollywoodDebi
6,What's Trump's plan for Syria?,[],,12.0,"Syria, Trump, ForeignPolicy, politics",Trump's::*1*||Syria::*4*||,,0,,2019-02-16 18:12:51.632141,36003,ibtauris
7,Five different policies in two weeks,[],,12.0,"Syria, Trump, ForeignPolicy, politics",,,1,,2019-02-16 18:12:51.632141,36003,ibtauris
8,Trump's Son Eric Trump says Syria strike was influenced by 'heartbroken and outraged' Sister Ivanka.,[],,12.0,,Trump's Son Eric Trump::*0*1*2*3*||Syria::*5*||Sister Ivanka::*13*14*||,,0,,2019-02-16 18:12:51.632954,36004,KenKariukiM
9,WTF is that?,[],,12.0,,nan,,0,,2019-02-16 18:12:51.633954,36005,JadedCreative
10,You might be right about Ivanka.,[],,12.0,,Ivanka::*5*||,,0,,2019-02-16 18:12:51.634222,36006,Jannyplo
11,She's being used as an excuse though.,[],,12.0,,,,1,,2019-02-16 18:12:51.634222,36006,Jannyplo
12,BREAKING : WHOA!,[],,12.0,Trump,,,0,,2019-02-16 18:12:51.634939,36007,Andrea_4_Trump
13,Trump Just Put the FEAR OF GOD into the ΓÇ£Fat KidΓÇ¥ From North Korea,[],,12.0,Trump,Put the FEAR OF GOD::*2*3*4*5*6*||Kid::*10*||North Korea::*12*13*||,,1,,2019-02-16 18:12:51.634939,36007,Andrea_4_Trump
14,Toxic  doomed to disappoint supporters,[],,12.0,Trump,,,0,,2019-02-16 18:12:51.636048,36008,thecornerdoteu
15,WTF-o-the-day: Eric Trump says Donald Trump bombed Syria because Ivanka told him to -,[],,12.0,,Eric Trump::*1*2*||Donald Trump::*4*5*||Syria::*7*||Ivanka::*9*||,,0,,2019-02-16 18:12:51.636432,36009,ronnyburgandy
16,"No, but nice try",[],,12.0,,,,0,,2019-02-16 18:12:51.637497,36010,timdski
17,How Garland could torment Trump,[],,12.0,Trump,Garland::*1*||Trump::*4*||,,0,,2019-02-16 18:12:51.637823,36011,MEllen_hi
18,"""Garland argued that agencies revoking regulations must have at least...""",[],,12.0,Trump,,,1,,2019-02-16 18:12:51.637823,36011,MEllen_hi
19,"Awesome, good to know that wars can be started by the President's daughter now, cool",[],,12.0,,President's::*11*||,,0,,2019-02-16 18:12:51.638745,36012,Robby322
20,LOL : Rosie Thinks TrumpΓÇÖs Syria Airstrike Was Orchestrated BY PUTIN,[],,12.0,"Trump, AntiGlobalism",Rosie Thinks TrumpΓÇÖs Syria Airstrike::*2*3*4*5*6*||Orchestrated::*8*||PUTIN::*10*||,,0,,2019-02-16 18:12:51.639481,36013,Andrea_4_Trump
21,How Bentley stacks up to famous political mugshots,[],,12.0,"trump, USA",Bentley::*1*||,,0,,2019-02-16 18:12:51.640373,36014,news_political_
22,"Support Bashar, Support Stability, Make the Middle East Great Again!",[],,12.0,"ISIS, Syria, Trump",nan,,0,,2019-02-16 18:12:51.640842,36015,Mohamedgabr96
23,YesIt does,[],,12.0,"NewUnitedAirlinesMottos, NationalPetDay, LoveMySchoolDay, Outlook2017, KS04",nan,,0,,2019-02-16 18:12:51.641161,36016,RednaxalA
24,Assad and the US Eric Trump   Hasan Minhaj,[],,12.0,"NewUnitedAirlinesMottos, NationalPetDay, LoveMySchoolDay, Outlook2017, KS04",nan,,1,,2019-02-16 18:12:51.641161,36016,RednaxalA
25,"Still think she's America's ""sweetheart princess""?",[],,12.0,,America's::*3*||,,0,,2019-02-16 18:12:51.641520,36017,BigWinInTx
26,ΓÜí∩╕Å ΓÇ£Eric Trump suggests Ivanka influenced the Syria airstrikesΓÇ¥,[],,12.0,,Trump::*2*||Ivanka::*4*||Syria::*7*||,,1,,2019-02-16 18:12:51.641520,36017,BigWinInTx
27,Limitations of  was questioned by 's election.,[],,12.0,"democracy, Trump, TrumpMeetsAfrica, Africa",,,0,,2019-02-16 18:12:51.642532,36018,oaaigbe
28,@HassanIdayat @jgershman @JohnCampbellcfr @aire_da,[],,12.0,"democracy, Trump, TrumpMeetsAfrica, Africa",,,1,,2019-02-16 18:12:51.642532,36018,oaaigbe
29,The latest Uncensored  Political  News!,[],,12.0,trump,Uncensored Political News::*2*3*4*||,,0,,2019-02-16 18:12:51.643085,36019,USElectionRaces
30,Thanks to @dahle44 @cerci_elena @agilexing30,[],,12.0,trump,,,1,,2019-02-16 18:12:51.643085,36019,USElectionRaces
31,Which one is it?,[],,12.0,,,,0,,2019-02-16 18:12:51.643713,36020,Ranirants1
32,Retweeted Scott Dworkin (@funder):,[],,12.0,BREAKING,Retweeted Scott Dworkin::*0*1*2*||,,0,,2019-02-16 18:12:51.643996,36021,rrjdean
33,: Eric Trump filed papers to open a new branch of his foundation in...,[],,12.0,BREAKING,Eric Trump::*1*2*||,,1,,2019-02-16 18:12:51.643996,36021,rrjdean
34,Presents: Canadian Waves ΓÇô Howling From the Mountaintop,[],,12.0,"dapl, dogs, blm",Canadian Waves::*1*2*||Howling::*4*||Mountaintop::*7*||,,0,,2019-02-16 18:12:51.644879,36022,ChrisJeffries24
35,Cmon Crooked Media!,[],,12.0,,nan,,0,,2019-02-16 18:12:51.645665,36023,mikegehrke
36,@anamariecox @danpfeiffer @jonfavs,[],,12.0,,,,1,,2019-02-16 18:12:51.645665,36023,mikegehrke
37,Hookup interrupted at top of Florida Capitol building,[],,12.0,"trump, USA",Florida Capitol::*5*6*||,,0,,2019-02-16 18:12:51.645980,36024,news_political_
38,PHOTO!,[],,12.0,"Trump, RETWEET, MAGA",nan,,0,,2019-02-16 18:12:51.646502,36025,BinaryTradeNews
39,HereΓÇÖs why you shouldnΓÇÖt leave your car keys with car wash guys.,[],,12.0,"Trump, RETWEET, MAGA",,,1,,2019-02-16 18:12:51.646502,36025,BinaryTradeNews
40,BREAKING NEWS,[],,12.0,"Trump, RETWEET, MAGA",nan,,2,,2019-02-16 18:12:51.646502,36025,BinaryTradeNews
41,"On the other hand, it's the textbook example of why it's a bad idea to allow Presidents to put their children on thΓÇª",[],,12.0,,Presidents::*16*||,,0,,2019-02-16 18:12:51.647074,36026,danpfeiffer
42,Junior isn't too bright.,[],,12.0,,,,0,,2019-02-16 18:12:51.647910,36027,Rana_pipiens
43,Eric Trump: Syria missile strikes prove there's no Trump-Russia connection,[],,12.0,,Eric Trump::*0*1*||Syria::*2*||Trump-Russia::*8*||,,1,,2019-02-16 18:12:51.647910,36027,Rana_pipiens
44,For someone who hates illegal immigration you should educate yourself on your own background.,[],,12.0,uneducated,,,0,,2019-02-16 18:12:51.648787,36028,iMunchBox
45,@POTUS,[],,12.0,uneducated,,,1,,2019-02-16 18:12:51.648787,36028,iMunchBox
46,@politico @EricTrump the dumb  should shut his pie hole!,[],,12.0,trump,,,0,,2019-02-16 18:12:51.649364,36029,kim_bergen
47,We also know it's based on the amount of money Soros paid his son-in-law.,[],,12.0,,Soros::*10*||,,0,,2019-02-16 18:12:51.649744,36030,sevenwithcheese
48,Relax.,[],,12.0,,nan,,1,,2019-02-16 18:12:51.649744,36030,sevenwithcheese
49,"Jesus,  over Ivanka;s ""heartbroken"" feelings?",[],,12.0,SyriaStrikes,Ivanka;s::*2*||,,0,,2019-02-16 18:12:51.650441,36031,dprite1
50,What if China raises the manufacturing costs on her clothing line?,[],,12.0,SyriaStrikes,China::*2*||,,1,,2019-02-16 18:12:51.650441,36031,dprite1
51,President Ivanka??,[],,12.0,,nan,,0,,2019-02-16 18:12:51.651258,36032,BeyondBlunt
52,-- Eric Trump: Ivanka Trump influenced decision to launch Syria strikes | TheHill,[],,12.0,,Eric Trump::*1*2*||Ivanka Trump::*3*4*||Syria::*9*||TheHill::*12*||,,1,,2019-02-16 18:12:51.651258,36032,BeyondBlunt
53,@washingtonpost @POTUS You may have to...Sell the house Another behind...and sold the wife          ≡ƒÿ¥,[],,12.0,"UK, UAE, US, EU, AEC",Sell::*6*||,,0,,2019-02-16 18:12:51.652245,36033,TonSeewisahnAEC
54,"Also, it's disturbing that Eric Trump puts forward the ostensible domestic political achievement as the most prominent effect of airstrikes.",[],,12.0,,Eric Trump::*4*5*||,,0,,2019-02-16 18:12:51.653032,36034,JackGlaserPhD
55,"@BostonGlobe reports, a political backlash against cities is brewing.",[],,12.0,Trump,,,0,,2019-02-16 18:12:51.653865,36035,HarvardAsh
56,"@ReneeLoth asks, can cities survive ?",[],,12.0,Trump,,,1,,2019-02-16 18:12:51.653865,36035,HarvardAsh
57,UPDATE: Eric Trump just said something very revealing about IvankaΓÇÖs White House role,[],,12.0,,Eric Trump::*1*2*||IvankaΓÇÖs White House::*9*10*11*||,,0,,2019-02-16 18:12:51.654513,36036,QkTipcom
58,The uncertainty of Trump's leadership objectives is outrageous.,[],,12.0,,Trump's::*3*||,,0,,2019-02-16 18:12:51.655449,36037,Cindy63306167
59,I've got minders now.,[],,12.0,"whitehouse, Washington, DC, Trump, Gump",,,0,,2019-02-16 18:12:51.656060,36038,runroblarun
60,When Gump came to Trump...     ΓÇª,[],,12.0,"whitehouse, Washington, DC, Trump, Gump",Gump::*1*||Trump::*4*||,,1,,2019-02-16 18:12:51.656060,36038,runroblarun
61,Ohhhhh!!,[],,12.0,,nan,,0,,2019-02-16 18:12:51.656934,36039,Chet_G_NFL
62,That clears everything up.,[],,12.0,,,,1,,2019-02-16 18:12:51.656934,36039,Chet_G_NFL
63,Shut down the investigation everyone!,[],,12.0,,,,2,,2019-02-16 18:12:51.656934,36039,Chet_G_NFL
64,Wall Street/American Psycho stand in says we're good!,[],,12.0,,Wall Street::*0*1*||American Psycho::*2*3*||,,3,,2019-02-16 18:12:51.656934,36039,Chet_G_NFL
65,Eric Trump Admits His Sister Influenced PresidentΓÇÖs Decision to Strike Syria     ΓÇª,[],,12.0,"Occupy, OWS, occupywallstreet, Occup",Eric Trump Admits::*0*1*2*||Sister Influenced PresidentΓÇÖs Decision::*4*5*6*7*||Strike Syria::*9*10*||,,0,,2019-02-16 18:12:51.658065,36040,1freetruth
66,Poll reveals the most popular senator in America -,[],,12.0,"tcot, MAGA, Trump",America::*7*||,,0,,2019-02-16 18:12:51.658961,36041,63red
67,"Well Eric, it's a good thing your opinion doesn't matter.",[],,12.0,,Eric::*1*||,,0,,2019-02-16 18:12:51.659532,36042,TheRobHoffman
68,That's the ticket≡ƒÿé≡ƒÿé≡ƒÿé≡ƒÿé≡ƒÿé,[],,12.0,,,,0,,2019-02-16 18:12:51.660262,36043,Lynnsmith63Lynn
69,Eric Trump looks like a warning about the dangers of Fetal Alcohol Syndrome.,[],,12.0,,Eric Trump::*0*1*||Fetal Alcohol Syndrome::*10*11*12*||,,0,,2019-02-16 18:12:51.660556,36044,ClassicKirov
70,Those damn squinty eyed people better get the message when we nuke them again,[],,12.0,"TRUMP, NorthKorea, friedrice",,,0,,2019-02-16 18:12:51.661315,36045,MemeSanders1313
71,Eric Trump says something very revealing about Ivanka's White House role (via @CillizzaCNN),[],,12.0,,Eric Trump::*0*1*||Ivanka's White House::*7*8*9*||,,0,,2019-02-16 18:12:51.661789,36046,CNNPolitics
72,Dimwit trumpsplains kneejerk,[],,12.0,"TrumpRussiaCollusion, resist, trumplies",,,0,,2019-02-16 18:12:51.662516,36047,diffendoor
73,@eun_YS @ABC Why this is news is beyond me and why Eric Trump said it because he knew the sheep would fawn all over this statement,[],,12.0,,Eric Trump::*11*12*||,,0,,2019-02-16 18:12:51.662784,36048,mikekeyes4131
74,Figuring out time.,[],,12.0,"politics, trump",,,0,,2019-02-16 18:12:51.663566,36049,Carlandmike
75,Days the music dies.,[],,12.0,"politics, trump",,,1,,2019-02-16 18:12:51.663566,36049,Carlandmike
76,And the rise of Trump and Sanders.,[],,12.0,"politics, trump",Trump::*4*||Sanders::*6*||,,2,,2019-02-16 18:12:51.663566,36049,Carlandmike
77,Business Communicator Magazine is out!,[],,12.0,"trump, marketing",nan,,0,,2019-02-16 18:12:51.664526,36050,reneecormierpr
78,Conoce a Trumpbama.,[],,12.0,,nan,,0,,2019-02-16 18:12:51.664762,36051,olmedopato
79,Meet Trumpbama.,[],,12.0,,nan,,1,,2019-02-16 18:12:51.664762,36051,olmedopato
80,Eric Trump.,[],,12.0,,nan,,2,,2019-02-16 18:12:51.664762,36051,olmedopato
81,Black Ops 2,[],,12.0,,nan,,3,,2019-02-16 18:12:51.664762,36051,olmedopato
82,Hope all Three kids go bald like Dad!,[],,12.0,,Three::*2*||Dad::*7*||,,0,,2019-02-16 18:12:51.665197,36052,MoonAngelWings
83,Eric Trump out here snitching ≡ƒÿé,[],,12.0,,Eric Trump::*0*1*||,,0,,2019-02-16 18:12:51.666678,36053,LaydeeJayyy
84,YEAR 2O20 INSTRUMENTAL,[],,12.0,"trump, trap, trapmusic, trapgod, zillionarerecords, Instrumentals, beats, hits, syria",nan,,0,,2019-02-16 18:12:51.667115,36054,ZillionareR
85,ΓÇÖs Deception Is Aimed at,[],,12.0,"Washington, Russia, NorthKorea, Trump, Syria",Deception::*1*||Aimed::*3*||,,0,,2019-02-16 18:12:51.667273,36055,TornadoNewsLink
86,Why don't you enlist.,[],,12.0,,,,0,,2019-02-16 18:12:51.667794,36056,EdTalabear
87,You and the rest of the trumpies,[],,12.0,,,,1,,2019-02-16 18:12:51.667794,36056,EdTalabear
88,Eric Trump says something very revealing about Ivanka's White House role (via CillizzaCNN)  ΓÇª,[],,12.0,,Eric Trump::*0*1*||Ivanka's White House::*7*8*9*||CillizzaCNN::*12*||,,0,,2019-02-16 18:12:51.668460,36057,DeamfeDream
89,"""Eric Trump"" Wheres Mad dog Matis?",[],,12.0,,Eric Trump::*0*1*||Wheres Mad::*2*3*||Matis::*5*||,,0,,2019-02-16 18:12:51.669445,36058,s_cala
90,he was given credit for strong decisions.,[],,12.0,,,,1,,2019-02-16 18:12:51.669445,36058,s_cala
91,Looks more like Puss Mag-Matis whatever Trump wants he'll do,[],,12.0,,Puss Mag-Matis::*3*4*||Trump::*6*||,,2,,2019-02-16 18:12:51.669445,36058,s_cala
92,Personally just got a phone with lots of space and a card 2 LG V20 Sweet.,[],,12.0,TRUMP,2 LG V20 Sweet::*12*13*14*15*||,,0,,2019-02-16 18:12:51.671053,36059,queenmarcia44
93,Also stop that lying depraved dolt  @Twitter @WomenSaveUSA,[],,12.0,TRUMP,,,1,,2019-02-16 18:12:51.671053,36059,queenmarcia44
94,(from the ) 's proposal to eliminate the  payroll tax may be his worst idea yet,[],,12.0,"LATIMES, Trump, SocialSecurity",nan,,0,,2019-02-16 18:12:51.672375,36060,paparazzo504
95,Could be a big win today for Dems in Kansas.,[],,12.0,,Dems in Kansas::*7*8*9*||,,0,,2019-02-16 18:12:51.672578,36061,JDIYFR
96,Perfect timing for dumb comments from Eric Trump the Turnip @SMShow,[],,12.0,,Eric Trump the Turnip::*6*7*8*9*||,,1,,2019-02-16 18:12:51.672578,36061,JDIYFR
97,"Yes, send them first.",[],,12.0,"SyriaStrike, Ivanka",,,0,,2019-02-16 18:12:51.673667,36062,Nesting4Awhile
98,Especially since the  was 's idea per Eric Trump.,[],,12.0,"SyriaStrike, Ivanka",Eric Trump::*7*8*||,,1,,2019-02-16 18:12:51.673667,36062,Nesting4Awhile
99,says  turns on  bcuz of .,[],,12.0,"MSM, AltRight, Trump, SyriaStrikes, AltRight, MAGA",,,0,,2019-02-16 18:12:51.674419,36063,0Libertyordeath
100,Who is the  ?,[],,12.0,"MSM, AltRight, Trump, SyriaStrikes, AltRight, MAGA",,,1,,2019-02-16 18:12:51.674419,36063,0Libertyordeath
101,You all worried bout what Eric Trump says - u should be concerned about N. KOREA sending a Nuke to Cali,[],,12.0,,Eric Trump::*5*6*||N. KOREA::*14*15*||Nuke::*18*||Cali::*20*||,,0,,2019-02-16 18:12:51.674900,36064,Move_Fwd
102,"is the guy that goes ""what does this button do?""",[],,12.0,Trump,,,0,,2019-02-16 18:12:51.675997,36065,TaraBumDeYay
103,And just pushes it.,[],,12.0,Trump,,,1,,2019-02-16 18:12:51.675997,36065,TaraBumDeYay
104,≡ƒÜÇ≡ƒÆÑ,[],,12.0,Trump,,,2,,2019-02-16 18:12:51.675997,36065,TaraBumDeYay
105,"If you ask yourself in re Trump, ""How would a reality TV honey handle this situation?""",[],,12.0,,Trump::*6*||TV::*11*||,,0,,2019-02-16 18:12:51.676687,36066,OuterBoroRoyal
106,You will almost always guess correctly.,[],,12.0,,,,1,,2019-02-16 18:12:51.676687,36066,OuterBoroRoyal
107,Ivanka Trump helped convince Donald Trump to strike Syria: Eric Trump,[],,12.0,,Ivanka Trump::*0*1*||Donald Trump::*4*5*||Syria::*8*||Eric Trump::*9*10*||,,0,,2019-02-16 18:12:51.677690,36067,Crmclwolf
108,It is appalling that Trump is so easily manipulated.,[],,12.0,,Trump::*4*||,,0,,2019-02-16 18:12:51.678564,36068,CulturalHeresy1
109,"Eric Trump: ΓÇ£If there was anything that Syria [strike] did, it was to validate...  by  via @c0nvey",[],,12.0,JohnJHarwood,Eric Trump::*0*1*||Syria::*7*||,,0,,2019-02-16 18:12:51.679026,36069,AYODEJI52
110,he said it like it's okay.,[],,12.0,,nan,,0,,2019-02-16 18:12:51.679810,36070,pantsuhime
111,lmao,[],,12.0,,nan,,1,,2019-02-16 18:12:51.679810,36070,pantsuhime
112,"""Eric Trump"" Ivanka and Eric are the Trump pussies that daddy loves to grab",[],,12.0,,Eric Trump::*0*1*||Ivanka::*2*||Eric::*4*||Trump::*7*||,,0,,2019-02-16 18:12:51.680006,36071,ironmanJohnM
113,Donald Trump's Presidency is a JOKE.,[],,12.0,,nan,,0,,2019-02-16 18:12:51.680921,36072,_aspiringadult
114,Is this not enough to get him impeached?,[],,12.0,,,,1,,2019-02-16 18:12:51.680921,36072,_aspiringadult
115,Letting his daughter influence a freaking military strike???,[],,12.0,,,,2,,2019-02-16 18:12:51.680921,36072,_aspiringadult
116,@ananavarro ONE for u ..  enjoy ..ΓÇÖs  canΓÇÖt even organize the Easter Egg Roll,[],,12.0,"Trump, WH",ONE::*1*||Easter Egg Roll::*10*11*12*||,,0,,2019-02-16 18:12:51.681737,36073,NancyWonderful
117,"Donald Trump bombed Syria because Ivanka Trump told him to do it, says Eric Trump.",[],,12.0,,Donald Trump::*0*1*||Syria::*3*||Ivanka Trump::*5*6*||Eric Trump::*13*14*||,,0,,2019-02-16 18:12:51.682478,36074,TweetLatestNews
118,Truffles from Italy is out!,[],,12.0,"m├⌐xico, trump",nan,,0,,2019-02-16 18:12:51.683395,36075,icctrade
119,Stories via @AWanderingKiwi @ElisabetCassese @dental_surgery,[],,12.0,"m├⌐xico, trump",,,1,,2019-02-16 18:12:51.683395,36075,icctrade
120,Eric Trump says something very revealing about Ivanka's White House role (via CillizzaCNN),[],,12.0,,Eric Trump::*0*1*||Ivanka's White House::*7*8*9*||CillizzaCNN::*12*||,,0,,2019-02-16 18:12:51.683869,36076,Behzadon
121,I have faith.,[],,12.0,,,,0,,2019-02-16 18:12:51.684697,36077,walkinggator
122,"Their KARMA WILL find them, let it be soon!",[],,12.0,,KARMA::*1*||,,1,,2019-02-16 18:12:51.684697,36077,walkinggator
123,"Commentary by @PatrickBuchanan: ""Is  Enlisting in the  Party?""",[],,12.0,"Trump, War",Enlisting in the Party::*4*5*6*7*||,,0,,2019-02-16 18:12:51.685312,36078,Rasmussen_Poll
124,Exactly the opposite.,[],,12.0,,,,0,,2019-02-16 18:12:51.685889,36079,dbraiman
125,"Now that  know that  is no puppet, I wonder if they gave Putin his story about chemicals from Iraq?",[],,12.0,"Democrats, Trump",Putin::*12*||Iraq::*18*||,,0,,2019-02-16 18:12:51.686254,36080,unclemike75
126,@CNN Not like he would care anyway... Three cheers to double standards!,[],,12.0,trump,Three::*7*||,,0,,2019-02-16 18:12:51.687093,36081,mightymalte
127,I win the good dad contest.,[],,12.0,,,,0,,2019-02-16 18:12:51.687702,36082,mgbhighlander
128,Mine built low income housing; hers killed people.,[],,12.0,,,,1,,2019-02-16 18:12:51.687702,36082,mgbhighlander
129,"Don't piss off the princess, helluva democracy we have!",[],,12.0,,,,0,,2019-02-16 18:12:51.688273,36083,mindfullyMike
130,Good news if you question Trump's leadership.,[],,12.0,"resist, DumpTrump",Trump's::*5*||,,0,,2019-02-16 18:12:51.688670,36084,rachelglickman
131,Turns out Ivanka is in charge of the military.,[],,12.0,"resist, DumpTrump",Ivanka::*2*||,,1,,2019-02-16 18:12:51.688670,36084,rachelglickman
132,"Trump baby has no relevance whatsoever...no matter how hard he, or his brother, tries.",[],,12.0,,,,0,,2019-02-16 18:12:51.689527,36085,MplsMe
133,"should be the first to be fired, because he's really a bad influence for the 's WH, because he's the face of bigotry.",[],,12.0,"SteveBannon, Trump",WH::*16*||,,0,,2019-02-16 18:12:51.690030,36086,O530CarrisPT
134,Eric Trump: Ivanka Trump swayed father,[],,12.0,,Eric Trump::*0*1*||Ivanka Trump::*2*3*||,,0,,2019-02-16 18:12:51.690820,36087,MosherHartley
135,states he would exit   accord-slash US  regulation,[],,12.0,"Trump, global, climate, oil",US::*5*||,,0,,2019-02-16 18:12:51.691371,36088,meyers000111
136,Trump is terrified.,[],,12.0,"trump, antitrump",,,0,,2019-02-16 18:12:51.691804,36089,strongliketoro
137,Who did he piss off more?,[],,12.0,"trump, antitrump",,,1,,2019-02-16 18:12:51.691804,36089,strongliketoro
138,His Russian boss or the American people?,[],,12.0,"trump, antitrump",Russian::*1*||American::*5*||,,2,,2019-02-16 18:12:51.691804,36089,strongliketoro
139,"How @EricTrump, by warning Russia (who warned Assad) ahead of time?",[],,12.0,,Russia::*4*||Assad::*7*||,,0,,2019-02-16 18:12:51.692650,36090,berkfran
140,Very convincing.,[],,12.0,,,,1,,2019-02-16 18:12:51.692650,36090,berkfran
141,The truth will out.,[],,12.0,,,,2,,2019-02-16 18:12:51.692650,36090,berkfran
142,Eric Trump just said something very revealing about IvankaΓÇÖs White House┬árole,[],,12.0,,Eric Trump::*0*1*||IvankaΓÇÖs White House┬árole::*8*9*10*||,,0,,2019-02-16 18:12:51.693564,36091,politiciandirec
143,Eric trump has the kind of face you just wanna punch,[],,12.0,,,,0,,2019-02-16 18:12:51.694303,36092,yuhgrlbec
144,Those beautiful western women are wolves in sheep's clothing,[],,12.0,,,,0,,2019-02-16 18:12:51.694751,36093,teamAretha
145,Ivanka is about to catch these hands,[],,12.0,,,,0,,2019-02-16 18:12:51.695123,36094,mahnoorhaleem
146,How foreign policy should be made...,[],,12.0,,,,0,,2019-02-16 18:12:51.695455,36095,luketaylor7
147,"@SenSanders Saying he's ""forgotten"" them implies he cared about them at some point.",[],,12.0,,Saying::*1*||,,0,,2019-02-16 18:12:51.695772,36096,HickeyDevon
148,He never did.,[],,12.0,,nan,,1,,2019-02-16 18:12:51.695772,36096,HickeyDevon
149,He is ONLY a CONMAN.,[],,12.0,,nan,,2,,2019-02-16 18:12:51.695772,36096,HickeyDevon
150,"indeed, lol",[],,12.0,,,,3,,2019-02-16 18:12:51.695772,36096,HickeyDevon
151,So Ivanka is running foreign affairs in the White House?,[],,12.0,,Ivanka::*1*||White House::*8*9*||,,0,,2019-02-16 18:12:51.696626,36097,Woodmeister_46
152,"And by the way Eric, you need to stay out of politics!",[],,12.0,,Eric::*4*||,,1,,2019-02-16 18:12:51.696626,36097,Woodmeister_46
153,isn't nepotism illegal?,[],,12.0,,nan,,0,,2019-02-16 18:12:51.697669,36098,fuckdokyeom
154,this is ridiculous,[],,12.0,,nan,,1,,2019-02-16 18:12:51.697669,36098,fuckdokyeom
155,Eric Trump: Ivanka influenced Syria strike┬ádecision,[],,12.0,,Eric Trump::*0*1*||Ivanka::*2*||Syria::*4*||,,0,,2019-02-16 18:12:51.697860,36099,politiciandirec
156,Fun fact: There is an Eric Trump in every rich family it's like a rule or something,[],,12.0,,Eric Trump::*5*6*||,,0,,2019-02-16 18:12:51.698505,36100,vacuumslayer
157,Γ¡É∩╕Å  ΓÇó Eric Trump says his father was swayed by ΓÇÿheartbrokenΓÇÖ Ivanka to strike Syria: Trump's son Eric toldΓÇª,[],,12.0,Business,Eric Trump::*2*3*||Ivanka::*11*||Syria::*14*||Trump's::*15*||Eric::*17*||,,0,,2019-02-16 18:12:51.699236,36101,Tlemcen_City
158,(  made   that will  ),[],,12.0,"Trump, Just, Another, Move, Anger, Russia",,,0,,2019-02-16 18:12:51.700688,36102,rContentRich
159,#'Made,[],,12.0,"Trump, Just, Another, Move, Anger, Russia",nan,,1,,2019-02-16 18:12:51.700688,36102,rContentRich
160,"If there's no link tying Putin to Trump's campaign, than why are DT, Eric, & their allies overly defensive about it?",[],,12.0,,Putin::*5*||Trump's::*7*||DT::*12*||Eric::*13*||,,0,,2019-02-16 18:12:51.701027,36103,AssemblyRoomUSA
161,Not much consolation for 'ns living under constant attack.,[],,12.0,"Syria, SyriaStrikes",,,0,,2019-02-16 18:12:51.702005,36104,noahgo
162,"If they are talking, they are lying.",[],,12.0,,,,0,,2019-02-16 18:12:51.702397,36105,Summerlover_5
163,It's just a matter of who's lie is bigger.,[],,12.0,,,,1,,2019-02-16 18:12:51.702397,36105,Summerlover_5
164,"In this case, I would have to say Trump was NOT moved....",[],,12.0,,Trump::*8*||,,2,,2019-02-16 18:12:51.702397,36105,Summerlover_5
165,omfg if this is true.... ΓÜí∩╕Å ΓÇ£Eric Trump suggests Ivanka influenced the Syria airstrikesΓÇ¥,[],,12.0,,Trump::*8*||Ivanka::*10*||Syria::*13*||,,0,,2019-02-16 18:12:51.703406,36106,randeearakawa
166,Eric Trump Says Nepotism Is a ΓÇÿBeautiful ThingΓÇÖ and Twitter Goes Wild,[],,12.0,"Hollywood, news",Eric Trump Says Nepotism::*0*1*2*3*||Thing::*7*||Twitter Goes Wild::*9*10*11*||,,0,,2019-02-16 18:12:51.704261,36107,HollywoodSBlog
167,Enough of all the  family!,[],,12.0,"Trump, StopTrump, SaveAmerica, Resist",,,0,,2019-02-16 18:12:51.705100,36108,MargBeckwith
168,to,[],,12.0,"Trump, StopTrump, SaveAmerica, Resist",nan,,1,,2019-02-16 18:12:51.705100,36108,MargBeckwith
169,"Eric Trump will have ""First Holy Communion photo"" hair until the day he dies.",[],,12.0,,Eric Trump::*0*1*||First Holy Communion::*4*5*6*||,,0,,2019-02-16 18:12:51.705538,36109,timbutterly
170,Yup.,[],,12.0,Trump,nan,,0,,2019-02-16 18:12:51.706262,36110,SHAWPOSTER
171,Draining the swamp to build a  golf course.,[],,12.0,Trump,,,1,,2019-02-16 18:12:51.706262,36110,SHAWPOSTER
172,"Can't imagine that  is reacting well to being given ""red lines"" over ...",[],,12.0,"Trump, Syria",,,0,,2019-02-16 18:12:51.706796,36111,Josh__Atkins
173,Really?,[],,12.0,NunYaBizness,nan,,0,,2019-02-16 18:12:51.707264,36112,mimamound
174,@IvankaTrump step away.,[],,12.0,NunYaBizness,,,1,,2019-02-16 18:12:51.707264,36112,mimamound
175,Ivanka Trump influenced my father to launch the Syria military strike - Eric Trump reveals: In a new interview withΓÇª,[],,12.0,,Ivanka Trump::*0*1*||Syria::*8*||Eric Trump::*12*13*||,,0,,2019-02-16 18:12:51.707561,36113,Iam_timkidda
176,American history is full of stories like the one Eric Trump told  - family and people close to @POTUS have always influenced them.,[],,12.0,,Eric Trump::*9*10*||,,0,,2019-02-16 18:12:51.708493,36114,themaxburns
177,What?????!!!!,[],,12.0,,,,0,,2019-02-16 18:12:51.709530,36115,rizkiyunias
178,+++ mr  - all promises are lies - now he is going to wars -  ΓÇª ΓÇª,[],,12.0,"trump, cnn, cnbc, ny, nasdaq, reuters, ap",,,0,,2019-02-16 18:12:51.709809,36116,genenano
179,"USA's new slogan: ""Land of the Free, Home of the Brave & Country Where People FAIL Upwards.""",[],,12.0,"POTUS, Trump, Nepotism, Kushner",Land of the Free::*3*4*5*6*||Home of the Brave::*7*8*9*10*||Country::*12*||People FAIL Upwards::*14*15*16*||,,0,,2019-02-16 18:12:51.710358,36117,garywidom
180,What the actual fuck≡ƒÿ│,[],,12.0,,,,0,,2019-02-16 18:12:51.711633,36118,mattersofmind
