,TweetSentence,annotation,calai_candidates,entry_batch,hashtags,phase1Candidates,ritter_candidates,sentID,stanford_candidates,start_time,tweetID,user
3493,"Ivanka Trump Influenced FatherΓÇÖs Decision to Authorize Syria Missile Strike, Eric Trump Says",[],,12.0,,nan,,0,,2019-02-16 18:12:53.085360,38142,agnesmbedard
3494,"Last week, my daughter smeared poop all over herself.",[],,12.0,,,,0,,2019-02-16 18:12:53.085777,38143,aric
3495,"So, I get it.",[],,12.0,,,,1,,2019-02-16 18:12:53.085777,38143,aric
3496,More sexism from this administration.,[],,12.0,,,,0,,2019-02-16 18:12:53.086396,38144,luvauntyruth
3497,Disgusting.,[],,12.0,,nan,,1,,2019-02-16 18:12:53.086396,38144,luvauntyruth
3498,"And I'm no ivanka fan, believe me.",[],,12.0,,,,2,,2019-02-16 18:12:53.086396,38144,luvauntyruth
3499,≡ƒÄâ≡ƒÿé,[],,12.0,trump,,,0,,2019-02-16 18:12:53.086971,38145,paparcura
3500,"Poor greedy one, wherever he runs He's after food, and death is after him.",[],,12.0,trump,,,1,,2019-02-16 18:12:53.086971,38145,paparcura
3501,(Saadi),[],,12.0,trump,nan,,2,,2019-02-16 18:12:53.086971,38145,paparcura
3502,≡ƒñö≡ƒæëIdries Shah,[],,12.0,trump,Shah::*1*||,,3,,2019-02-16 18:12:53.086971,38145,paparcura
3503,"Most normal Americans, our Military, Allies and people worldwide as well.",[],,12.0,,Americans::*2*||Military::*4*||Allies::*5*||,,0,,2019-02-16 18:12:53.087857,38146,GlennMorrisUSA
3504,"Left/Dem/Thugs are NOT normal and approve the gassing, obviously",[],,12.0,,Dem::*1*||Thugs::*2*||,,1,,2019-02-16 18:12:53.087857,38146,GlennMorrisUSA
3505,"And an interview from February, 2016 talking about his plan",[],,12.0,"Trump, MAGA","February, 2016::*4*5*||",,0,,2019-02-16 18:12:53.089133,38147,MissMaga2016
3506,Samson's downfall,[],,12.0,,,,0,,2019-02-16 18:12:53.089806,38148,KadirAnfield
3507,Adam's Downfall,[],,12.0,,nan,,1,,2019-02-16 18:12:53.089806,38148,KadirAnfield
3508,Dumelo's V8 saga,[],,12.0,,Dumelo's V8::*0*1*||,,2,,2019-02-16 18:12:53.089806,38148,KadirAnfield
3509,Was all orchestrated by women.,[],,12.0,,,,3,,2019-02-16 18:12:53.089806,38148,KadirAnfield
3510,This should terrify all of us.,[],,12.0,,,,0,,2019-02-16 18:12:53.090553,38149,cmileskania
3511,Major decisions are vetted through a proxy whose specialty is handbags and shoes.,[],,12.0,,,,1,,2019-02-16 18:12:53.090553,38149,cmileskania
3512,@mmpadellan.,[],,12.0,,,,0,,2019-02-16 18:12:53.091245,38150,nancymck1211
3513,Why is Eric Trump talking?,[],,12.0,,Eric Trump::*2*3*||,,1,,2019-02-16 18:12:53.091245,38150,nancymck1211
3514,Did he get elected?,[],,12.0,,,,2,,2019-02-16 18:12:53.091245,38150,nancymck1211
3515,Isn't he dumber than a box of hair?,[],,12.0,,,,3,,2019-02-16 18:12:53.091245,38150,nancymck1211
3516,Dumping the Press leads to World assessment without US coverage...,[],,12.0,,Dumping the Press::*0*1*2*||World::*5*||US::*8*||,,0,,2019-02-16 18:12:53.092090,38151,Trishalla2012
3517,Ivanka & @MelaniaTrump have some compassion.,[],,12.0,"Trump, stopwearingfur",,,0,,2019-02-16 18:12:53.092798,38152,ijanis51
3518,Here is your fur coat!,[],,12.0,"Trump, stopwearingfur",,,1,,2019-02-16 18:12:53.092798,38152,ijanis51
3519,He had feelings & needs.,[],,12.0,"Trump, stopwearingfur",,,2,,2019-02-16 18:12:53.092798,38152,ijanis51
3520,≡ƒÄâ≡ƒÿé,[],,12.0,trump,,,0,,2019-02-16 18:12:53.093424,38153,paparcura
3521,"My name is Ozymandias, king of kings: Look on my works, ye Mighty, and despair!",[],,12.0,trump,Ozymandias::*3*||Look::*7*||Mighty::*12*||,,1,,2019-02-16 18:12:53.093424,38153,paparcura
3522,≡ƒñö≡ƒæëPercy Bysshe Shelley,[],,12.0,trump,Bysshe Shelley::*1*2*||,,2,,2019-02-16 18:12:53.093424,38153,paparcura
3523,And common sense leadership.,[],,12.0,"NorthKorea, TRUMP",,,0,,2019-02-16 18:12:53.094556,38154,PheroNike
3524,Trump voters are scattered around like little chickens w/our heads  ≡ƒæì≡ƒÅ╜,[],,12.0,"NorthKorea, TRUMP",,,1,,2019-02-16 18:12:53.094556,38154,PheroNike
3525,Ask Eric why daddy called Putin who then called Assad to give him 24hrs to move all planes.,[],,12.0,,Ask Eric::*0*1*||Putin::*5*||Assad::*9*||24hrs::*13*||,,0,,2019-02-16 18:12:53.095192,38155,Bckrda
3526,Mattis lied saying 20% of Assads planes dstryd.,[],,12.0,,20% of Assads::*3*4*5*||,,1,,2019-02-16 18:12:53.095192,38155,Bckrda
3527,"Hope everyrone has a wonderful Easter holiday, except the MSM whores !",[],,12.0,"MAGA, Trump, AmericaFirst, fakenews",Easter::*5*||MSM::*9*||,,0,,2019-02-16 18:12:53.096471,38156,rharrisonfries
3528,@POTUS,[],,12.0,"MAGA, Trump, AmericaFirst, fakenews",,,1,,2019-02-16 18:12:53.096471,38156,rharrisonfries
3529,RT-ACTION ALERT: Call Devin Nunes' office & ask why he's obstructing   investigation (202)225-2523,[],,12.0,"Trump, KremlinKlan",RT-ACTION ALERT::*0*1*||Call Devin Nunes::*2*3*4*||,,0,,2019-02-16 18:12:53.097199,38157,ijanis51
3530,Donald Trump Ruined Shonda Rhimes' Original 'Scandal' Endgame,[],,12.0,Trump,nan,,0,,2019-02-16 18:12:53.097913,38158,RightWingTube
3531,@POTUS This INEPT & INCOMPETENT MAN-CHILD @realDonaldTrump is getting US into a HUGE MESS!,[],,12.0,"IMPEACH, TRAITOR",INEPT::*2*||INCOMPETENT MAN-CHILD::*4*5*||US::*9*||HUGE MESS::*12*13*||,,0,,2019-02-16 18:12:53.098206,38159,urconstituent
3532,the  &   BAD,[],,12.0,"IMPEACH, TRAITOR",BAD::*2*||,,1,,2019-02-16 18:12:53.098206,38159,urconstituent
3533,What a jackass.,[],,12.0,,,,0,,2019-02-16 18:12:53.099381,38160,UpperFalls
3534,This is not your family business.,[],,12.0,,,,1,,2019-02-16 18:12:53.099381,38160,UpperFalls
3535,It's my country!,[],,12.0,,,,2,,2019-02-16 18:12:53.099381,38160,UpperFalls
3536,@potus should surround himself with the best brains not best looks.,[],,12.0,,,,3,,2019-02-16 18:12:53.099381,38160,UpperFalls
3537,3 ways  has embarrassed  re.,[],,12.0,"Putin, Trump, Syria",nan,,0,,2019-02-16 18:12:53.100255,38161,ScreaminSardine
3538,Does the Trumpet think we're so stupid that we don't know that's exactly what they want us to think?,[],,12.0,,Trumpet::*2*||,,0,,2019-02-16 18:12:53.100409,38162,RebeccaStefoff
3539,"""I got sick of selling handbags made in sweatshops, now I help my daddy start wars!""",[],,12.0,"Trump, SyriaStrikes",,,0,,2019-02-16 18:12:53.101087,38163,redtornado_
3540,Dear POTUS - facts trump feelings...,[],,12.0,"TuesdayThoughts, Syria",POTUS::*1*||,,0,,2019-02-16 18:12:53.101617,38164,BanTheBosh
3541,"Remember the guy with ""dead"" twins in Syria ""chemical attack""?",[],,12.0,"Trump, Assad",Syria::*7*||,,0,,2019-02-16 18:12:53.102030,38165,chrisk2000
3542,He's a Turkey operative,[],,12.0,"Trump, Assad",Turkey::*2*||,,1,,2019-02-16 18:12:53.102030,38165,chrisk2000
3543,@FareedZakaria @CNN @maddow @JoyAnnReid @SMShow @MSNBC @ABC @CBSEveningNews @mtaibbi @VanJones68  is this Presidential?,[],,12.0,,Presidential::*12*||,,0,,2019-02-16 18:12:53.102888,38166,Aprylsmithts
3544,knows the score....,[],,12.0,Trump,nan,,0,,2019-02-16 18:12:53.103361,38167,bournevexed
3545,What do the US GOP & Saudi Arabia have in common?,[],,12.0,Trump,US GOP::*3*4*||Saudi Arabia::*6*7*||,,0,,2019-02-16 18:12:53.103517,38168,ijanis51
3546,They implement laws about women with NOT 1 WOMAN PRESENT!,[],,12.0,Trump,1 WOMAN PRESENT::*7*8*9*||,,1,,2019-02-16 18:12:53.103517,38168,ijanis51
3547,Worried about North Korea.,[],,12.0,TRUMP,nan,,0,,2019-02-16 18:12:53.104562,38169,FordMcCartney
3548,R we going to war with NK or China?Or is China tired of NK BS?,[],,12.0,TRUMP,NK::*6*||China::*8*||China::*11*||NK::*14*||,,1,,2019-02-16 18:12:53.104562,38169,FordMcCartney
3549,Either way Giant Baby Man is going to war,[],,12.0,TRUMP,Giant Baby Man::*2*3*4*||,,2,,2019-02-16 18:12:53.104562,38169,FordMcCartney
3550,Russia calls for Syria gas attack investigation,[],,12.0,,Syria::*3*||,,0,,2019-02-16 18:12:53.105929,38170,jeremynewberger
3551,Eric Trump: See?,[],,12.0,,nan,,1,,2019-02-16 18:12:53.105929,38170,jeremynewberger
3552,I mean why would Russia be investigating this if they had ties to my dad?,[],,12.0,,Russia::*4*||,,2,,2019-02-16 18:12:53.105929,38170,jeremynewberger
3553,≡ƒÄâ≡ƒÿé,[],,12.0,trump,,,0,,2019-02-16 18:12:53.106902,38171,paparcura
3554,Good things could happen to not so bad people.,[],,12.0,trump,,,1,,2019-02-16 18:12:53.106902,38171,paparcura
3555,≡ƒñö≡ƒæëMike Gayle,[],,12.0,trump,Gayle::*1*||,,2,,2019-02-16 18:12:53.106902,38171,paparcura
3556,THAT is not right!,[],,12.0,,,,0,,2019-02-16 18:12:53.107621,38172,robertabear2
3557,These ill bred offspring need to stay out of Government business!,[],,12.0,,Government::*9*||,,1,,2019-02-16 18:12:53.107621,38172,robertabear2
3558,Go back to selling your clothes princess!,[],,12.0,,,,2,,2019-02-16 18:12:53.107621,38172,robertabear2
3559,And @theresa_may ignoring her...same mistake she made with  .,[],,12.0,trump,,,0,,2019-02-16 18:12:53.108754,38173,qiauto
3560,So out of touch....,[],,12.0,trump,,,1,,2019-02-16 18:12:53.108754,38173,qiauto
3561,@PrisonPlanet What is your reading: What is the main reason for 's 180 degree turn?,[],,12.0,Trump,,,0,,2019-02-16 18:12:53.109374,38174,Lars9596
3562,Security Orgs having him by the balls?,[],,12.0,Trump,Security Orgs::*0*1*||,,1,,2019-02-16 18:12:53.109374,38174,Lars9596
3563,"THE MEDIA RAN TO HELP TRUMP AND PUTIN, THE JOURNALISTS THAT PRAISED TRUMP YOU IDIOTS STOP REPORTING ON THIS FOOL",[],,12.0,,nan,,0,,2019-02-16 18:12:53.110296,38175,zjparker5310
3564,Dumb bitch smh,[],,12.0,,,,0,,2019-02-16 18:12:53.110496,38176,ilatovr
3565,≡ƒÿé≡ƒÿé≡ƒÿé and they usually laugh at us for electing corrupt leaders?,[],,12.0,,nan,,0,,2019-02-16 18:12:53.110776,38177,djhover01
3566,Let's WAKE UP people,[],,12.0,,WAKE::*1*||,,0,,2019-02-16 18:12:53.110946,38178,agtechgreg
3567,has difficulty getting beyond the bleedin obvious in foreign policy.,[],,12.0,Trump,,,0,,2019-02-16 18:12:53.111349,38179,johncornelius01
3568,That's its job.,[],,12.0,Trump,,,1,,2019-02-16 18:12:53.111349,38179,johncornelius01
3569,Hillary Clinton dons namesake pumps designed by Katy Perry -  -,[],,12.0,"USPolitics, trump, potus",Hillary Clinton::*0*1*||Katy Perry::*7*8*||,,0,,2019-02-16 18:12:53.111966,38180,diypotus
3570,Maybe she could go to Gaza?,[],,12.0,,Gaza::*5*||,,0,,2019-02-16 18:12:53.112707,38181,justwaitfirit
3571,Catch the recent  from my     where I talk about  and ΓÇª,[],,12.0,"show, podcast, jeffs, cents, trump, syria",,,0,,2019-02-16 18:12:53.113178,38182,Jeffs_2Cents
3572,Pretty screwed.,[],,12.0,,,,0,,2019-02-16 18:12:53.113696,38183,GhoulRay69
3573,≡ƒÄâ≡ƒÿé,[],,12.0,trump,,,0,,2019-02-16 18:12:53.113958,38184,paparcura
3574,"When he studied, it was not so much for a promotion as to EXCEL at his job.",[],,12.0,trump,EXCEL::*13*||,,1,,2019-02-16 18:12:53.113958,38184,paparcura
3575,≡ƒñö≡ƒæëDavid Halberstam,[],,12.0,trump,Halberstam::*1*||,,2,,2019-02-16 18:12:53.113958,38184,paparcura
3576,Eric Trump: Syria strike shows there is no 'tie' between President Trump and Russia -,[],,12.0,,Eric Trump::*0*1*||Syria::*2*||Trump::*11*||Russia::*13*||,,0,,2019-02-16 18:12:53.114903,38185,WhatYouKnowRock
3577,"Eric Trump sais Syria strike wasn't a distraction from Russia Investigation, it was 'cause Ivanka has feelings.",[],,12.0,,Eric Trump::*0*1*||Syria::*3*||Russia Investigation::*9*10*||Ivanka::*14*||,,0,,2019-02-16 18:12:53.115836,38186,coehren
3578,"She gets those, she's a girl",[],,12.0,,,,1,,2019-02-16 18:12:53.115836,38186,coehren
3579,Senate voted 52-47 to murder Hibernating Bears.,[],,12.0,"Trump, KremliKlan, GOP",52-47::*2*||Hibernating Bears::*5*6*||,,0,,2019-02-16 18:12:53.117137,38187,ijanis51
3580,PSYCHOPATHS!,[],,12.0,"Trump, KremliKlan, GOP",nan,,1,,2019-02-16 18:12:53.117137,38187,ijanis51
3581,"Do think that maybe Eric Trump  doesn't know what ""nepotism"" means ?",[],,12.0,Ivanka,Eric Trump::*4*5*||,,0,,2019-02-16 18:12:53.117847,38188,Nerdparent
3582,"did have trouble with ""complicit""",[],,12.0,Ivanka,,,1,,2019-02-16 18:12:53.117847,38188,Nerdparent
3583,≡ƒÄâ≡ƒÿé,[],,12.0,trump,,,0,,2019-02-16 18:12:53.118576,38189,paparcura
3584,She had reason to doubt him; he was real good at planning but real bad at doing.,[],,12.0,trump,,,1,,2019-02-16 18:12:53.118576,38189,paparcura
3585,≡ƒñö≡ƒæëJunot D az,[],,12.0,trump,,,2,,2019-02-16 18:12:53.118576,38189,paparcura
3586,Eric is a moron for saying this out loud even if it's true (better not be!).,[],,12.0,,,,0,,2019-02-16 18:12:53.119408,38190,nofolady
3587,"He's the dimmest bulb in the Trump basket, for sure.",[],,12.0,,Trump::*6*||,,1,,2019-02-16 18:12:53.119408,38190,nofolady
3588,≡ƒÄâ≡ƒÿé,[],,12.0,trump,,,0,,2019-02-16 18:12:53.120375,38191,paparcura
3589,Judge not unless you judge yourself,[],,12.0,trump,,,1,,2019-02-16 18:12:53.120375,38191,paparcura
3590,≡ƒñö≡ƒæëBob Marley,[],,12.0,trump,Marley::*1*||,,2,,2019-02-16 18:12:53.120375,38191,paparcura
3591,Are President 's recent airstrikes in  a game-changer?,[],,12.0,"Trump, Syria",,,0,,2019-02-16 18:12:53.121003,38192,gmfus
3592,Read GMF's Derek Chollet's latest take:,[],,12.0,"Trump, Syria",Read GMF's Derek Chollet's::*0*1*2*3*||,,1,,2019-02-16 18:12:53.121003,38192,gmfus
3593,I was against the bombing too.,[],,12.0,,,,0,,2019-02-16 18:12:53.121730,38193,MoyerM5
3594,"However, how is bombing a military base concidered bombing civilians?",[],,12.0,,,,1,,2019-02-16 18:12:53.121730,38193,MoyerM5
3595,Dumb tweet.,[],,12.0,,,,2,,2019-02-16 18:12:53.121730,38193,MoyerM5
3596,Lindsey Graham karioka,[],,12.0,"NationalPetDay, NewUnitedAirlinesMottos",Lindsey Graham::*0*1*||,,0,,2019-02-16 18:12:53.122432,38194,_SCOTUS
3597,"""I am woman, here me roar""",[],,12.0,"NationalPetDay, NewUnitedAirlinesMottos",,,1,,2019-02-16 18:12:53.122432,38194,_SCOTUS
3598,Women of the Senate,[],,12.0,"NationalPetDay, NewUnitedAirlinesMottos",nan,,2,,2019-02-16 18:12:53.122432,38194,_SCOTUS
3599,≡ƒÄâ≡ƒÿé,[],,12.0,trump,,,0,,2019-02-16 18:12:53.123073,38195,paparcura
3600,"The measure of wisdom is in simplicity, humility, and in friendliness.",[],,12.0,trump,,,1,,2019-02-16 18:12:53.123073,38195,paparcura
3601,≡ƒñö≡ƒæëDebasish Mridha M D,[],,12.0,trump,Mridha::*1*||,,2,,2019-02-16 18:12:53.123073,38195,paparcura
3602,Fuck help us!,[],,12.0,,,,0,,2019-02-16 18:12:53.123838,38196,dannibo123
3603,@GOP Dont gut Endangered Species Act!,[],,12.0,trump,Endangered Species Act::*3*4*5*||,,0,,2019-02-16 18:12:53.124100,38197,ijanis51
3604,It has been the most effective tool against extinction.,[],,12.0,trump,,,1,,2019-02-16 18:12:53.124100,38197,ijanis51
3605,war on animals,[],,12.0,trump,,,2,,2019-02-16 18:12:53.124100,38197,ijanis51
3606,Neil Gorsuch Has Cafeteria Duty as Part of His SCOTUS 'Hazing',[],,12.0,"Politics, Trump, USA",nan,,0,,2019-02-16 18:12:53.124995,38198,USGovReport
3607,"And Clinton haters complained about a ""dynasty.""",[],,12.0,,Clinton::*1*||,,0,,2019-02-16 18:12:53.125335,38199,MidwstMaelstrom
3608,Trump Jumps Into Kansas Election That Has GOP Nervous,[],,12.0,"Politics, Trump, USA",nan,,0,,2019-02-16 18:12:53.125827,38200,USGovReport
3609,Eric Trump: U.S. airstrikes in Syria heavily influenced by Ivanka Trump's motherhood,[],,12.0,,Eric Trump::*0*1*||U.S::*2*||Syria::*5*||Ivanka Trump's::*9*10*||,,0,,2019-02-16 18:12:53.126125,38201,Charliemagne
3610,"|US is planning missile strikes on Damascus, claims Putin  |",[],,12.0,trump,Damascus::*6*||Putin::*8*||,,0,,2019-02-16 18:12:53.127025,38202,gracehawthorne_
3611,Ask her about Us decision to withdraw funding to UN Population fund and how many children will die because of it.,[],,12.0,,Us::*3*||UN Population::*9*10*||,,0,,2019-02-16 18:12:53.127647,38203,JohnJulia18
3612,Media doing everything they can to normalize Trump,[],,12.0,,Trump::*7*||,,0,,2019-02-16 18:12:53.128518,38204,SmartOne8927
3613,@Justa_decoy @RVAwonk Sure seems that way.,[],,12.0,,Sure::*2*||,,0,,2019-02-16 18:12:53.129027,38205,robinmay
3614,this says it all.,[],,12.0,,nan,,0,,2019-02-16 18:12:53.129447,38206,katekes
3615,this is how dumb they think we are...,[],,12.0,,nan,,1,,2019-02-16 18:12:53.129447,38206,katekes
3616,@dodo @USFWS This is not good news for manatee.,[],,12.0,trump,,,0,,2019-02-16 18:12:53.129647,38207,ijanis51
3617,This is about the  admin dismantling Endangered Species Act,[],,12.0,trump,Endangered Species Act::*6*7*8*||,,1,,2019-02-16 18:12:53.129647,38207,ijanis51
3618,Eric may be the least self aware person on the planet.,[],,12.0,,,,0,,2019-02-16 18:12:53.130463,38208,DonLinn
3619,"Ivanka's politics are wholly grounded in ""feelings"".",[],,12.0,,,,1,,2019-02-16 18:12:53.130463,38208,DonLinn
3620,What a group...,[],,12.0,,,,2,,2019-02-16 18:12:53.130463,38208,DonLinn
3621,≡ƒÄâ≡ƒÿé,[],,12.0,trump,,,0,,2019-02-16 18:12:53.131328,38209,paparcura
3622,Always buy pornographic books in hardback because they're easier to hold with one hand.,[],,12.0,trump,,,1,,2019-02-16 18:12:53.131328,38209,paparcura
3623,≡ƒñö≡ƒæëRobert Clark,[],,12.0,trump,Clark::*1*||,,2,,2019-02-16 18:12:53.131328,38209,paparcura
3624,So it's Ivanka's fault for the air strikes........,[],,12.0,,Ivanka's::*2*||,,0,,2019-02-16 18:12:53.132139,38210,hrhpurplehayes
3625,"Eric Trump says his sister, Ivanka Trump, encouraged their father to carry out strikes at a Syrian airbaseΓÇª  cnni",[],,12.0,,Eric Trump::*0*1*||Ivanka Trump::*5*6*||Syrian::*16*||,,0,,2019-02-16 18:12:53.132723,38211,Maneenutju
3626,@BennettJohnT @chrislhayes What a moron Eric Trump is.,[],,12.0,,Eric Trump::*5*6*||,,0,,2019-02-16 18:12:53.133673,38212,LindaSchoenberg
3627,"This actually seems like a perfectly reasonable analogy, tbh",[],,12.0,,,,0,,2019-02-16 18:12:53.134142,38213,DrJJoyner
3628,"You had me up until ""scorpion.""",[],,12.0,,,,0,,2019-02-16 18:12:53.134557,38214,SmugMarx
3629,this @RunJewels :        [B],[],,12.0,"Watch, interview, Trump, Politics, Music, KanyeWest, Race, HipHop",,,0,,2019-02-16 18:12:53.134884,38215,cabrash
3630,≡ƒÄâ≡ƒÿé,[],,12.0,trump,,,0,,2019-02-16 18:12:53.135246,38216,paparcura
3631,"When he left, you spent all your energy holding on to him.",[],,12.0,trump,,,1,,2019-02-16 18:12:53.135246,38216,paparcura
3632,You could be happy if you let go.,[],,12.0,trump,,,2,,2019-02-16 18:12:53.135246,38216,paparcura
3633,≡ƒñö≡ƒæëStephenie Meyer,[],,12.0,trump,Meyer::*1*||,,3,,2019-02-16 18:12:53.135246,38216,paparcura
3634,She's a Dr. Amai,[],,12.0,,nan,,0,,2019-02-16 18:12:53.136181,38217,Mr_Bvlgari
3635,"@Duck_person @samsteinhp @Susan_Hennessey Sam, a major point Eric made was Trump will trust Ivanka over others cuz she can be frank w/him & tell him what he doesn't want to hear.",[],,12.0,,Sam::*3*||Eric::*7*||Trump::*10*||Ivanka::*13*||,,0,,2019-02-16 18:12:53.136440,38218,Gummi_Gal
3636,Now we know who is in charge in the White House!,[],,12.0,,White House::*9*10*||,,0,,2019-02-16 18:12:53.137594,38219,lucylabella2
3637,Eric Trump is not a very smart person.,[],,12.0,,Eric Trump::*0*1*||,,0,,2019-02-16 18:12:53.138137,38220,spenstar_warman
3638,It doesn't get any clearer than this.,[],,12.0,,,,0,,2019-02-16 18:12:53.138610,38221,MontyBoa99
3639,@OfficeGovEthics @NormEisen @CREWcrew @tribelaw,[],,12.0,,,,1,,2019-02-16 18:12:53.138610,38221,MontyBoa99
3640,Kansas Democrats Are About To Show How Big The Anti-Trump Wave Actually Is Yes!,[],,12.0,"Brownback, Trump",nan,,0,,2019-02-16 18:12:53.139059,38222,mckansas
3641,Finally We Get To Shine!,[],,12.0,"Brownback, Trump",nan,,1,,2019-02-16 18:12:53.139059,38222,mckansas
3642,We Hate  &,[],,12.0,"Brownback, Trump",Hate::*1*||,,2,,2019-02-16 18:12:53.139059,38222,mckansas
3643,"@IvankaTrump The dying is not going to stop in Syria, we should be opening our borders to Syrian refugees, speak up.",[],,12.0,,Syria::*9*||Syrian::*17*||,,0,,2019-02-16 18:12:53.139766,38223,CassieJ01780
3644,≡ƒÄâ≡ƒÿé,[],,12.0,trump,,,0,,2019-02-16 18:12:53.140602,38224,paparcura
3645,Life is a barter of choice and consequences.,[],,12.0,trump,,,1,,2019-02-16 18:12:53.140602,38224,paparcura
3646,≡ƒñö≡ƒæëSamantha Sotto,[],,12.0,trump,Sotto::*1*||,,2,,2019-02-16 18:12:53.140602,38224,paparcura
3647,Trump: You need to cut down on your cocaine spending you useless pos,[],,12.0,,,,0,,2019-02-16 18:12:53.141272,38225,DuckSpeech
3648,Eric: alrighty Im gonna leak your Pornhub account,[],,12.0,,Im::*2*||Pornhub::*6*||,,1,,2019-02-16 18:12:53.141272,38225,DuckSpeech
3649,≡ƒÄâ≡ƒÿé,[],,12.0,trump,,,0,,2019-02-16 18:12:53.142186,38226,paparcura
3650,Life truly is what you make it.,[],,12.0,trump,,,1,,2019-02-16 18:12:53.142186,38226,paparcura
3651,The purpose and meaning of life is the purpose and meaning that you give it.,[],,12.0,trump,,,2,,2019-02-16 18:12:53.142186,38226,paparcura
3652,≡ƒñö≡ƒæëSteven Redhead,[],,12.0,trump,Redhead::*1*||,,3,,2019-02-16 18:12:53.142186,38226,paparcura
3653,Eric Trump,[],,12.0,,nan,,0,,2019-02-16 18:12:53.143209,38227,DeploRalph
3654,"If it was Michelle Obama influencing decisions the Left would fall all over themselves and say how wonderful, how progressive!",[],,12.0,,Michelle Obama::*3*4*||Left::*8*||,,1,,2019-02-16 18:12:53.143209,38227,DeploRalph
3655,@FiveRights @JackieAnia People did t come up with that theory on their own.,[],,12.0,,People::*2*||,,0,,2019-02-16 18:12:53.144074,38228,KeNd0_
3656,Just saying,[],,12.0,,,,1,,2019-02-16 18:12:53.144074,38228,KeNd0_
3657,≡ƒÄâ≡ƒÿé,[],,12.0,trump,,,0,,2019-02-16 18:12:53.144728,38229,paparcura
3658,Don't say mourning.,[],,12.0,trump,,,1,,2019-02-16 18:12:53.144728,38229,paparcura
3659,It's too psychoanalytic.,[],,12.0,trump,,,2,,2019-02-16 18:12:53.144728,38229,paparcura
3660,I'm not mourning.,[],,12.0,trump,,,3,,2019-02-16 18:12:53.144728,38229,paparcura
3661,I'm suffering.,[],,12.0,trump,,,4,,2019-02-16 18:12:53.144728,38229,paparcura
3662,≡ƒñö≡ƒæëRoland Barthes,[],,12.0,trump,Barthes::*1*||,,5,,2019-02-16 18:12:53.144728,38229,paparcura
3663,Eric Trump: Father wonΓÇÖt be ΓÇÿpushed aroundΓÇÖ by Putin,[],,12.0,,Eric Trump::*0*1*||Father::*2*||Putin::*8*||,,0,,2019-02-16 18:12:53.145672,38230,NewsComplex
3664,Said 600K  Created In Mtg w/ Leaders!,[],,12.0,"Trump, Jobs, Infrastructure, business, economy, Blacks, NYC, WallStreet, women",Said 600K Created In Mtg::*0*1*2*3*4*||Leaders::*6*||,,0,,2019-02-16 18:12:53.146375,38231,sunnyherring1
3665,$100M up in smoke because nothing's too good for my little girl!,[],,12.0,,,,0,,2019-02-16 18:12:53.146993,38232,ControlCentral1
3666,via @TPM,[],,12.0,,,,1,,2019-02-16 18:12:53.146993,38232,ControlCentral1
3667,Eric Trump told @dailytelegraph that Pres.,[],,12.0,,Eric Trump::*0*1*||Pres::*5*||,,0,,2019-02-16 18:12:53.147556,38233,ajplus
3668,"Trump was influenced to launch missiles into Syria after Ivanka was ""heaΓÇª",[],,12.0,,Syria::*7*||Ivanka::*9*||,,1,,2019-02-16 18:12:53.147556,38233,ajplus
3669,≡ƒÄâ≡ƒÿé,[],,12.0,trump,,,0,,2019-02-16 18:12:53.148749,38234,paparcura
3670,that is what abuse is: knowing you are going to get salt but still hoping for sugar for nineteen years.,[],,12.0,trump,,,1,,2019-02-16 18:12:53.148749,38234,paparcura
3671,≡ƒñö≡ƒæëAmanda Lovelace,[],,12.0,trump,Lovelace::*1*||,,2,,2019-02-16 18:12:53.148749,38234,paparcura
3672,Victim Was Psychiatrist Helping Asylum Seekers,[],,12.0,"StockholmAttack, Stockholm, tcot, Trump",nan,,0,,2019-02-16 18:12:53.149792,38235,CaptHaddock83
3673,Eric Trump Says Syria Strike Was Swayed By ΓÇÿHeartbrokenΓÇÖ Ivanka  via @NBCNews,[],,12.0,,Eric Trump Says Syria Strike::*0*1*2*3*4*||Swayed::*6*||Ivanka::*9*||,,0,,2019-02-16 18:12:53.150107,38236,Synergy3k
3674,"@JuddApatow Poor, out of the loop Eric.",[],,12.0,,Poor::*1*||Eric::*6*||,,0,,2019-02-16 18:12:53.150928,38237,jpear02
3675,Third Trump child syndrome.,[],,12.0,,Third Trump::*0*1*||,,1,,2019-02-16 18:12:53.150928,38237,jpear02
3676,Ivanka cares about children and will be the first woman president.,[],,12.0,,,,0,,2019-02-16 18:12:53.151837,38238,harpus88
3677,"""Eric Trump""",[],,12.0,,nan,,1,,2019-02-16 18:12:53.151837,38238,harpus88
3678,This guy is senior politics editor at Huff post!!??,[],,12.0,,Huff::*7*||,,0,,2019-02-16 18:12:53.152434,38239,Malcom321f
3679,We may be doomed.,[],,12.0,,,,1,,2019-02-16 18:12:53.152434,38239,Malcom321f
3680,Come on MSM this is not that difficult - do your jobs or quit!,[],,12.0,,Come on MSM::*0*1*2*||,,2,,2019-02-16 18:12:53.152434,38239,Malcom321f
3681,Watch Charlize Theron Kill Commies With Stiletto Heels in Sick New ΓÇÿAtomic BlondeΓÇÖ Trailer     ΓÇª,[],,12.0,"trump, life, love, dea",Watch Charlize Theron Kill Commies::*0*1*2*3*4*||Stiletto Heels in Sick New::*6*7*8*9*10*||BlondeΓÇÖ Trailer::*12*13*||,,0,,2019-02-16 18:12:53.153632,38240,ChrisJeffries24
3682,Eric Trump told dailytelegraph that Pres.,[],,12.0,,Eric Trump::*0*1*||Pres::*5*||,,0,,2019-02-16 18:12:53.154742,38241,Behzadon
3683,"Trump was influenced to launch missiles into Syria after Ivanka was ""heaΓÇª",[],,12.0,,Syria::*7*||Ivanka::*9*||,,1,,2019-02-16 18:12:53.154742,38241,Behzadon
3684,"@annaleclaire @horseaunt @BrittPettibone @d_seaman @llcoolj I guess Eric Trump is thinking the same thing, he says Ivanka had a lot to do with it.",[],,12.0,,Eric Trump::*7*8*||Ivanka::*16*||,,0,,2019-02-16 18:12:53.155836,38242,sushiqk_2
3685,Vladimir  says he expects 'fake' gas attacks in  to justify further  strikes on  !,[],,12.0,"Putin, Damascus, US, Syria, Trump",,,0,,2019-02-16 18:12:53.156726,38243,EuropeUnion
3686,United Airlines Is Getting Brutally Ripped By Jimmy Kimmel and Practically Everyone Else on Social Media   ΓÇª,[],,12.0,"trump, l",United Airlines::*0*1*||Getting Brutally Ripped::*3*4*5*||Jimmy Kimmel::*7*8*||Practically::*10*||Social Media::*14*15*||,,0,,2019-02-16 18:12:53.157259,38244,ChrisJeffries24
3687,This is bullshit and sexist!,[],,12.0,,,,0,,2019-02-16 18:12:53.158379,38245,luvauntyruth
3688,Hiding your inadequacy behind the woman.,[],,12.0,,,,1,,2019-02-16 18:12:53.158379,38245,luvauntyruth
3689,Admit your a fake potus pos.,[],,12.0,,,,2,,2019-02-16 18:12:53.158379,38245,luvauntyruth
