ID,HashTags,TweetText,mentions_other,mentions_other_limited_types,URLs,User
531,social distancing,"@Neoavatara If we’d acted sooner, with moderate social distancing + tons of tests, with strict quarantining/tracing…",,,,VAReadjuster89
532,social distancing,"I've been calling for a national lockdown for weeks. Nothing else will work. A real lockdown, no transit, no plane…",;;;,;;;,,ZevShalev
533,social distancing,@piersmorgan I’m sure you won’t read this but in my opinion all congestion charges should be cut and all nhs worker…,,,,RachelHerron8
534,social distancing,"@DavidLammy Now is not the time to apportion blame, now is the time to work together, have your spats when this is…",,,,HilaryTaylor638
535,social distancing,"Social distancing, day 11: I used my one form of exercise to run into the nearby countryside",,,,AshKelly0
536,social distancing,@nflnetwork @MikeGarafolo @RapSheet I think this social distancing has created something special in our world that…,,,,DialloKreed
537,social distancing,"Malignant maggot is on, hit the mute button!!! Big form of social distancing!!",;;,;;,,ariesjill
538,social distancing,@AnneMilgram All social distancing measurements should be done in Penguins ? #CafeInsider @PreetBharara,Penguins,,,jason_farns
539,social distancing,The Miami downtown police need to enforce social distancing among all the homeless sleeping next to each other at t…,Miami,Miami,,dookie1890
540,social distancing,So tired of these “Press Conferences” with @realDonaldTrump talking about social distancing when he and @Mike_Pence…,,,,BlossomCBrown
541,social distancing,my family is practicing social distancing by only grocery shopping once a week #digicom,,,,grace0connor
542,social distancing,"Trump to reporters, spaced out for social distancing, at daily press briefing at WH: ""Look at all the empty seats.…",Trump,Trump,,DavidNakamura
543,social distancing,Why are we having a White House coronavirus briefing in-person when we're social distancing? Why can't this be done via video?,"White House, coronavisur;;",;;,,JayMalaney
544,social distancing,This is what responsible social distancing looking like. I’m part of the supply chain so every day I go out I’m at…,;;,;;,,Darrenstarr1313
545,social distancing,social distancing (from others) in the park? @jwilIiamson @LeeTryston,,,,sarahmorghanz
546,social distancing,@GovAndyBeshear Making the best out of our season so for with Social Distancing! Still trying to have a little fun…,;;,;;,,SLeanhart
547,social distancing,@PeterMcCormack Remove the lockdowns for everyone under 60 (your rule is stupid). Distribute masks to the entire po…,;;,;;,,BryanJacoutot
548,social distancing,"#NOW: KY Gov. Andy Beshear: Remember social distancing is not social isolation, but we need you to be healthy at ho…",Andy Beshear,Andy Beshear,,DanGriffinWLWT
549,social distancing,Day 5. At walmart. No one practicing social distancing. This is why COVID-19 is spreading.,walmart;;COVID-19;,;;;,,KLoeblich
550,social distancing,A scoreboard developed by a NYC-based data firm grades each state and county on how well its residents are practici…,,,,ParkSlopePatch
551,social distancing,"I don’t know why people are complaining about social distancing, it not we interact with each other in real life an…",,,,itz_leesha
552,social distancing,Your attitude impacts everyone ?? Please continue to practice good hygeine and social distancing,;;,,,chrischincano
553,social distancing,"Hey Titans, it's ok to enjoy the fresh air and a few close friends...from a distance. Had to remind @mswallsphs and…",;;;,,,cnwalmonphs
554,social distancing,my stepdad won't let me out for two weeks cuz I just got back from the city but asks why I'm not coming downstairs.…,,,,LaurenRubb
555,social distancing,These people in smart line don’t kno nothing about social distancing smt all up in a nigga space ?,,,,Shyne649
556,social distancing,@sextsbot That's good social distancing,,,,Funkopedia
557,social distancing,Is social distancing making you lose weight or gain weight ?,,,,YOUNGLYXX
558,social distancing,"Trump to rank US counties by Coronavirus risk, may 'relax' social distancing via @nypost","Trump, US, coronavirus","Trump, US",,RichTorrenzano
559,social distancing,@riarenouf @NEWS1130 @TransLink Maybe someone should ask translink what they are actually doing to support their em…,,,,AgnewRhiana
560,social distancing,A reminder of the health value of #touch during these unnatural social distancing times. Touch can help reduce stre…,;;,;;,,3dancingfeet
561,social distancing,Social distancing and hand washing are being practiced,,,,Lanthedan
562,social distancing,@iLLiNouT My account is social distancing ?,,,,Its_Jus_Obama
563,social distancing,this is how social distancing looks like...,,,,belderrainmn
564,social distancing,Has anyone else googled social distancing pickup lines yet??,,,,M0NSTER0USM0USE
565,social distancing,@realDonaldTrump starts by joking about social distancing of reporters,,,,rongartner1
566,social distancing,"I’m so proud of my dad, he’s been practicing social distancing since 1991.",,,,HashtagDJRhino
567,social distancing,"I have absolutely no problem with isolation. Social distancing is my normal routine, always been a homebody so this…",;;,;;,,itzx_Britney
568,social distancing,@LibbySchaaf Thank you @LibbySchaaf! How can we ensure greater social distancing at Lake Merritt? This is from yest…,;Lake Merritt;;,;Lake Merritt;;,,Peteberk
569,social distancing,"@Johnnydrille Social distancing ooo, Johnny!",Johnny,Johnny,,jobosonchisa
570,social distancing,"@Sam__Weller @jeffjenkins312 They truly are. Good for social distancing - even inside. (I do like the current occupants, to be clear!)",;;;,;;;,,jjl_ice_yard
571,social distancing,You know who's really suffering in these social distancing times? Waldo. Very easy to spot now.,;Waldo;;,;Waldo;;,,SparkyMacMillan
572,social distancing,@writhing_south Social distancing? How bout them apples,;;,;;,,DumbGearhead
573,social distancing,Social distancing practices in Hartford and Tolland counties seem to be in line with ways to flatten the coronaviru…,"Hartford, Tolland","Hartford, Tolland",,SouthngtnPatch
574,social distancing,Social distancing comes naturally to the taciturn Scandinavians of the upper Midwest. We were born just a little reserved. ?,;;,;;,,SixFiveArms
575,social distancing,Funny T-Shirt | Just Social Distancing With My Dog T-Shirt | H by BellaVitaConcepts via…,,,,debbie_calianno
576,social distancing,@GovHolcomb Well there are still people who aren't following orders in Hamilton with practicing social distancing and self quarantining...,Hamilton,Hamilton,,dylan_hardwin
577,social distancing,Sent the kids outside to do some sidewalk art- they decided to write messages to the neighbors out for walks since…,,,,nathangreer
578,social distancing,Going back to the beginning of @kelseydangerous 100 baby challenge is my #kelseys100happydays for today. Fun during…,;;,;;,,katieren87
579,social distancing,"#PRWR623 To me, ""physical distancing"" and ""distant socializing"" seem a lot more intuitive than ""social distancing""…",,,,JKeweshan
580,social distancing,"In the era of #covid19 and social/physical distancing, I realized I miss touching people!",,,,IamGuhad
581,social distancing,Sign the @teamcoworker petition to tell @cvspharmacy to protect its employees and support social distancing!…,,,,wordyblerd
582,social distancing,Twitter bringing out all the freak in ppl ???y’all nasty nasty huh and I never knew it lmaoo this social distancing…,Twitter;;,;;,,ShadvsTwiter
583,social distancing,@CNNPolitics More out right LIES FROM CNN Trump didn't say to stop social distancing,;Trump;,;Trump;,,Rick_NEPA
584,social distancing,"Me: so there’s cops in Central Park making sure everyone is social distancing, not congregating too close My mom:…",Central Park,,,samthestewart
585,social distancing,All smiles when a coworker drives by to say hello @CoachCSullivan Social distancing at its best.,,,,SCWLAX
586,social distancing,Hey everyone! -,,,,umassdcatholic
587,social distancing,Perk #4 of social distancing = a floor that doubles as many board games #findthepositives,,,,LynseyWhite2
588,social distancing,@itvcalendar #ClapForCarers #clapforNHS epic fail re social distancing.,,,,rinka_dog
589,social distancing,"@AaronBaileyTur1 @DerbysPolice @DerPolDroneUnit Exactly, agreed 100%! We are in strange, and scary times and the la…",;;,;;,,_christina_jane
590,social distancing,I’m sick and tired of social distancing and about to decide which one of my roommates to sacrifice to the gods to end this shit,,,,chrystallynn04
591,social distancing,I’ve been social distancing since 2016 when I moved to Colorado lol. #boomin,Colorado,Colorado,,imKRUMM
592,social distancing,Emergency social distancing now oh my god #covideoparty,,,,Beakyblack
593,social distancing,"@HillaryClinton @realDonaldTrump Your husband has been doing social distancing from you for years, possibly decades",,,,christomaass
594,social distancing,"I want to shout out one hospital hero, in particular. My neighbor, Rachel, has been working the @UCSFHospitals ER ",;Rachel;,;Rachel;,,AaronPeskin
595,social distancing,@scottcooper79 @GiveBloodNHS Social distancing at all times extra questions and sanitising. Felt really safe,;;,;;,,NeilBanks13
596,social distancing,@BCrawford70 @NorthernStarQ @johnpavlovitz @lilibalfour @FLOTUS @realDonaldTrump Dont you have a geriatric conventi…,,,,ButterRumsfield
597,social distancing,"@DanaPerino Dana, those nurses wearing trash bags because no gowns! They are wearing bags over the gowns. Also d…",Dana;;,Dana;;,,TerriRN4
598,social distancing,"With many schools closed due to the #coronavirus, kids are stuck at home. How can you keep kids and teens learning…",;;,;;,,FLIllustrated
599,social distancing,"@_Jack_Preston Yeah, I’m picturing the rolling green hills of heather (or whatever that flower is) and plenty of so…",,,,ChristyCooperB1
600,social distancing,This is how you enjoy the lakefront during coronavirus. Even Baron the dog is practicing social distancing! ?…,coronavirus; Baron;,;;,,Julia_Kline
601,social distancing,"The exponential effects of #SocialDistancing to slow the #coronavirus, it's in the data >>> @StatistaCharts via…",,,,SamiGhazali
602,social distancing,"I ain’t social distancing from a virus , but I’m doing it for my mental peace",,,,MarleyNichelle
603,social distancing,Summit-Hill and Grand neighborhoods really don't give a fuck about social distancing. It's wild.,"Summit-Hill, Grand;;",;;,,brenface
604,social distancing,"@LauraRose92: Im gonna get a surprise my nose is really itchy... Oh its really itchy, its gonna be a big one Me:…",;;,;;,,TGyton
605,social distancing,"@CassandraRules I wish people were doing this in Chicago, but so far it's not my experience. So many people aren't…",Chicago;;,Chicago;;,,NYKensington
606,social distancing,@BeckettUnite @LauraPidcock @SkyUK heres there response to a confirmed case of coronavirus in their dunfermline c…,coronavirus,,,bettyboopxoxox
607,social distancing,More social distancing.,,,,cyclingreporter
608,social distancing,"""No social distancing needed for this one.- - -BTW, one positive outcome from all this: animal…"" ? coram nobis",;;,;;,,decourseydave
609,social distancing,Biggest takeaway: those with a ‘Bohemian sex life’ must not have sex,,,,benjnielsen
610,social distancing,Social distancing people c'mon.,,,,ViewssFromWhit
611,social distancing,@knockknockjoan @DavidBegnaud The theme I see when it comes to this specific govt is a lack of communication & tran…,,,,michaelcdeibert
612,social distancing,┏┓ ┃┃?? IN ┃???? THIS ?????? HOUSE ??┗┛?? WE PRACTICE ?????????? ? SOCIAL ??┏┳┓??┏┳┓ ?? DISTANCING ??┗┻┛┃┃┗┻┛??,,,,PunCMD
613,social distancing,my neighbor (same one who decided not to practice social distancing & have friends over a couple of nights ago) is…,,,,emiliebridges
614,social distancing,NYC construction workers complain coronavirus rules for protection and social distancing are impossible…,NYC,NYC,,JoseAquinoEsq
615,social distancing,Now y’all can stay y’all butts at home,,,,DarkSkinBarbie_
616,social distancing,Frankurt am Main. <26 Mar 2020> Stopped by to watch the sunset after my grocery run. Was riding my e-board so socia…,Frankurt;;;,Frankurt;;;,,ohmyjadd
617,social distancing,@bandherbooks George doesn't understand social distancing,George,George,,kelly_kobiela
618,social distancing,My cat doesn't understand what social distancing is apparently,,,,EUNHAE20
619,social distancing,"This is not how you practice social distancing! They are waiting for the bus, in case you are wondering.",;;,;;,,GreenSkyOverMe
620,social distancing,"Social distancing, proper hand washing, cough and sneeze etiquette and personal hygiene should be observed at all t…",,,,iam_JVP6382
621,social distancing,when he over six feet (away from me because we’re practicing social distancing) ?,,,,kelllicopter
622,social distancing,Social distancing should really be permanent. Give me my space in line. Don’t park next to me and do not sit next to me!,;;;,;;;,,isiahpettway
623,social distancing,How well are states social distancing? One start-up used cellphone data to try to measure it,;;,;;,,ProvincetownBa2
624,social distancing,"Social distancing has been pretty rough for Jan here, no one has responded to their dick pic DMs so they have resor…",,,,PlayWithJambo
625,social distancing,Tell Congress to provide funding to expand access and voter registration to aid voters casting their ballots during…,,,,macbeestje
626,social distancing,@TheVegemite @EricRWeinstein Social distancing happened too late in New York to prevent at least 30k infections. My…,New York;;,New York;;,,AmandaLeftCoast
627,social distancing,Our newest tool to help us do our jobs while still social distancing.,,,,DillonFox5
628,social distancing,Practicing social distancing may feel dangerous for those experiencing domestic violence. Please stay connected to…,;;,;;,,NYCFirstLady
629,social distancing,Social distancing level: Expert ? #Saluki,,,,VickiBetton
630,social distancing,Unless you live with that person social distancing does not mean hanging out with different friends every day we’re…,,,,chloehoward17
631,social distancing,Trump tells US governors he's preparing new social distancing guidelines. WTF. WTF. WTF.,"Trump, US;;;;","Trump, US;;;;",,TexasManz
632,social distancing,@sardesairajdeep @MamataOfficial thats an example of rajdeeps lame journalism. if this was someone from bjp the guy…,;;,;;,,aforamod
633,social distancing,@wallsartlwt +towards easing essential e-commerce. on the bright side many states are coming up with ways to practi…,;;,;;,,sparklyblue28
634,social distancing,"@TeamJoe @JoeBiden VP Biden, please be more vocal, we have an idiot for president that is putting us in danger with…",Biden,Biden,,Cruz4873
635,social distancing,Social Distancing Pick up A Scicilian! Gotta have a pizza ? fix! (@ Giuseppe's Brothers Pizza) on #Yelp,;;,;;,,JohnGuyeski
636,social distancing,@kenradio Shelter in place: check Social distancing: fail,,,,3arnhardt
637,social distancing,@TronGumby I was playing this a few weeks ago! After all this social distancing blows over you're welcome to come over and rock out :D,;;,;;,,Dreadiedude
638,social distancing,"“Remember that social distancing is not social isolation, but we need you to be healthy at home. Model the kinds of…",;;,;;,,PantsuitPolitic
639,social distancing,"Wow. A pretty big uptick in precautionary measures (washing hands, social distancing etc) taken by members of the B…",,,,nicholaraihani
640,social distancing,"WEEK 2 - SELF QUARANTINE / SOCIAL DISTANCING Stay safe, hopeful and positive during this time. ????.My week 2 A…",;;,;;,,DannyArroyo
641,social distancing,#FlattentheCurve by Reading - this is a COVID-19 social distancing reading challenge via @goodreads,COVID-19,,,YABooksAreLife
642,social distancing,Everytime we time touch went against social distancing advice and now she has it smh,,,,taylor_bonnesx
643,social distancing,"@theJDuce @radionz But we're all allowed to go out for walks as long as we maintain social distancing, right?",,,,ilikeprettycode
644,social distancing,Social distancing is important for all of us to follow & is crucial for preventing the spread of #COVID19 in…,,,,OakGov
645,social distancing,Social distancing,,,,gregphil
646,social distancing,I am really impressed with business' response to Coronavirus and how quickly they have developed solutions for sta…,,,,JakeMis3538
647,social distancing,Beshear: Social distancing is not social isolation. But we need you to be healthy at home. The grocery isn't a soci…,Beshear;;;,Beshear;;;,,WFPLNews
648,social distancing,Minnesota summer I just around the corner to practice some social distancing on the lakes. I made this video in 201…,Minnesota;;,Minnesota;;,,ELinaresFilms
649,social distancing,"@GlitterOnTheGo Hi there, thanks for reaching out. We do allow associates to wear gloves [or a mask] if the associa…",;;,;;,,Hannaford
650,social distancing,@econet_support Thank you @econet_support I thought you’re closing your shops due to Covid19 social distancing. Isn…,Covid19;;,;;,,tawazmataz1
651,social distancing,Me social distancing @ArianaGrande @FrankieJGrande love them,,,,mxnboca
652,social distancing,Joey and I had a blast in the Robinson teacher parade today! It was so good to see so many smiling faces!! Thank yo…,"Joey, Robinson;;;","Joey, Robinson;;;",,DebraMatus
653,social distancing,Social distancing kept per capita flu-related deaths in St. Louis to less than half of those in Philadelphia Ending…,"St.Louis, Philadelphia","St.Louis, Philadelphia",,deedeeindetroit
654,social distancing,@G_Vazquez15 They will ? getting drunk while social distancing ?,;;,;;,,Nyjahhhhhhhh
655,social distancing,@DrOz @Doctorsuevarma I am watching your interview today with the Dr. and shocked by the fact that you are sitting…,,,,shirleysee10
656,social distancing,@hughriminton @TheLyonsDen And people in Sydney eastern suburbs practice social distancing and isolating after returning from OS.,Sydney,Sydney,,Covid20209
657,social distancing,"Spent 1 hr speaking to staff @RMPGPsurgery worried about coming into workplace, social distancing and concerns for…",,,,Dochayter
658,social distancing,@SpiderCage We just need to continue social distancing until #46 takes control.,,,,JuliIndica
659,social distancing,"casuals angry for loss of work, customers rude and aggressive at the idea of social distancing and the workers tryi…",,,,katticus28
660,social distancing,@SimonHarrisTD Social distancing in the Dail ?,,,,nilbymouth
661,social distancing,@youbunchofmarks @TimeOutChicago The Governor’s EO grants permission to go to the parks provided you practice socia…,,,,KijaKalimbre
662,social distancing,@taylorswift13 #QuarantineCats lol! My cat everyday! Luna is very good at social distancing. On another note-my son…,;;;,;;;,,Christi33920747
663,social distancing,"@BeauchampDr Yes, I've been, in my head, using this term, because I feel it's more apt, and doesn't seem to conjure…",,,,TimJRees
664,social distancing,"In accordance with the statewide, stay-at-home order, all playground equipment, picnic areas, tennis and basketball…",,,,TownOfMead
665,social distancing,@sardesairajdeep What behavior are you promoting here? Most of the Bengalis working outside Bengal. Is the reason…,";;Bengalis, Bengal;",;;Bengal;,,unni99860
666,social distancing,@thomaskaine5 I guess that is good enough news to end the social distancing requirements and purposely infect more people.,,,,bryan_johnsen
667,social distancing,#TrumpPressConference #coronatesting Trump wants to loosen up on social distancing based on 'geographic risk factor…,Trump,Trump,,cargal
668,social distancing,One of the hardest things right now is refraining from offering help to people moving out because of social distancing. ):,,,,jearbear006
669,social distancing,@FairwayMarket PLEASE enforce social distancing. Many drugstores and supermarkets limiting customers. Went to 125th…,;;;,;;;,,RightonNYC
670,social distancing,"I have a feeling if you all don’t practice social distancing and isolation, football next season will be canceled.…",,,,xandra_mari
671,social distancing,WATCH LIVE: Members of the U.S. Coronavirus Task Force hold a briefing.,"U.S., Coronavirus","U.S., Coronavirus",,WISH_TV
672,social distancing,"I just saw a dude buy a whole box of cigarillos in 7/11. The whole ?, not just a few packs. Either he is planning a…",;;;;,,,my_royality
673,social distancing,.@CityofHoboken @RaviBhalla Can we shutdown some roads for social distancing like NYC plans to do? How about River…,NYC;;,NYC;;,,verondoms
674,social distancing,"This ball traveled an estimated 4 miles and back in approximately 5 seconds, father son catch on opening day, socia…",,,,jcjdnut
675,social distancing,Trump says new coronavirus 'guidelines' will address potential changes to social distancing rules,Trump,Trump,,OzarksVet
676,social distancing,Social distancing fail!,,,,Kashandara
677,social distancing,"@CNNPolitics What do ""wishes"" mean, has the president recommended we end social distancing?",,,,JackMartensite
678,social distancing,Going to an empty beach an hour and a half from your house with 6 friends is not social distancing,,,,skyymathers
679,social distancing,Social distancing just a nod @RobboRanx @bujubanton Robboranxradio ooooooooooo ?????????????????????????cough is like a gun shot ppls move,Robboranxradio;;,Robboranxradio;;,,Plivelifegood
680,social distancing,@realLukeMurray things are getting real mate I woke up this morning with the biggest fat ever the wife give me the…,,,,seadoomad
681,social distancing,"Watch live: President Trump, other members of White House coronavirus task force give daily briefing","Trump, coronavirus","Trump, coronavirus",,KTLA
682,social distancing,"Social distancing thing is going well, I first did it when I was a kid when my dad left me",,,,paki_waffles
683,social distancing,SOCIAL DISTANCING,,,,GravitySpaceMeo
684,social distancing,i miss anecia and cynthia fuck this quarantine and social distancing bullshit,,,,faesongs
685,social distancing,"Check out our latest video, on social distancing! Make sure to subscribe to our YouTube ch…",;YouTube;,;YouTube;,,morningstarlab
686,social distancing,@redmcgraw1 @KathyJohnsonCCO @ErinOTooleMP 40 times the airports and much more disregarding social distancing (spr…,,,,newsman6611
687,social distancing,A great storyline for the upside case for #covid19 in the US is that despite not having the social compliance of a…,US,US,,gavin_kickstart
688,social distancing,"How can thebpresident establish social distancing guidelines when we cant even test to see who is low, medium or high risk. Dumbass",;;,;;,,jmafnp
689,social distancing,"#aap government doing great job, please try to maintain social distancing.. there are lot many pictures and videos…",;;,;;,,a_taher
690,social distancing,ITS FOUR PEOPLE. SOCIAL DISTANCING DIFFERS FROM QUARANTINING ????????,;;,;;,,_niyaamari
691,social distancing,Luke Skywalker: Social distancing before it was cool.,Luke Skywalker,Luke Skywalker,,KishaFisha
692,social distancing,"@SkyNews That's it, social distancing doesn't matter when the camera crews show up.. how else would they get a shot…",;;,;;,,DarkManatee
693,social distancing,Study by UT's Lauren Meyers & Dell Med shows why social distancing so important. Hopefully graphs convince central…,"Lauren Meyers,Dell;;","Lauren Meyers,Dell;;",,VikkiGoodwinTX
694,social distancing,@mjrowland68 @BreakfastNews Bite the bullet and admit hairdressing doesn't comply with social distancing and close…,,,,peter25631
695,social distancing,"@jeffmorgan1967 @CNN @realDonaldTrump @POTUS In the event, which I agree is entirely likely but--based on evolving…",,,,NanHayworth
696,social distancing,"No single step will suffice, WHO Director-General Tedros Adhanom Ghebreyesus stressed at a recent press conference.…",Tedros Adhanom Ghebreyesus,Tedros Adhanom Ghebreyesus,,wired_we
697,social distancing,Worried about coronavirus I tried social distancing. Here's why it failed.,coronavirus;;,;;,,3wombats
698,social distancing,@joewenker @Eric_T_MPLS He's practicing his social distancing.,,,,sklar37
699,social distancing,"Someone I know is not social distancing because ""we gotta get on with this thang"" and shes ""fit as anything probabl…",,,,furelisehernke
700,social distancing,It was lovely to see all my neighbours out for #clapforNHS earlier tonight. Social distancing was maintained!,;;,;;,,shann1972
701,social distancing,"As executive orders continue to tighten restrictions on Michigan citizens and businesses, City Pulse has received e…","Michigan, City Pulse","Michigan, City Pulse",,CityPulse
702,social distancing,"Perfect for social distancing at The Conch House. This is where I would like to be quarantined, how about you? ???…",Conch House;;,Conch House;;,,ConchHouseExuma
703,social distancing,21 savage just dropped the quote of the year on Tory Lanez live ? “Social distancing from all fuck niggas”,Tory Lanez;;,Tory Lanez;;,,mwllms94
704,social distancing,social distancing with day 12: started to ?actually? study today until that last presentation destroyed my one drop…,;;;,;;;,,not_kansu
705,social distancing,@VodkaMuse Damn social distancing! ?,,,,RobertCaruso72
