ID,HashTags,TweetText,mentions_other,mentions_other_limited_types,URLs,User
1411,social distancing,Shout out to @CompanyofBooks for the phone ordering and the social distancing delivery today of some much needed ne…,,,,Costellop
1412,social distancing,"Even the Jehovah's witnesses are social distancing, what's your excuse?",Jehovah,Jehovah,,yaelccourtney
1413,social distancing,"That being said, take of yourselves. Wash your hands, don’t touch your face, and practice social distancing. And…",;;,;;,,austyntatiouses
1414,social distancing,My lovely friends sent me flowers for my lonely birthday. Even the bouquets are social distancing!,;;,;;,,JenENelson12
1415,social distancing,"@wowhorse @BklynBckstretch The peeps were not practicing social distancing, they are literally stuck together.",,,,CAWittmer
1416,social distancing,"To the dude I just saw riding a tandem bike by himself: You’re a whole mood, my guy. Eccellent job social distancing ??",;;,;;,,_rylie_steele_
1417,social distancing,"@MarcAnglin10 I think Easter for NY,NJ,PA,MI,LA,WA,CA,MA,FL and IL are likely to still be on line. The rest of the…","NY,NJ,PA,MI,LA,WA,CA,MA,FL, IL;;","NY,NJ,PA,MI,LA,WA,CA,MA,FL, IL;;",,RichLloyd2
1418,social distancing,America is known around the world for violence. How long before incidents of COVID-related rage due to prolonged so…,America;;,America;;,,epic_honey
1419,social distancing,Gov Beshear is asking mayors and county judge-executives to monitor park areas. He says if people are playing bask…,Gov Beshear;;,Gov Beshear;;,,JenNimePalumbo
1420,social distancing,"Our president, the one that met you sometimes ago at the oval office has taken social distancing over zealously Pls…",,,,Collinsterol
1421,social distancing,@wheressthedope Social distancing monkaS,,,,superunsafe
1422,social distancing,Mommy : my child in this house look like she even practicing social distancing from me,,,,K_BossXo
1423,social distancing,"Read This: ""Want to Save the Economy? Listen to Fauci, Not Trump.""",";Fauci,Trump;",";Fauci,Trump;",,LmckCdaUsa
1424,social distancing,Crazy how y’all be preaching about “stay home!” “Social distancing!” “Take this serious so I can have my summer vac…,;;;,;;;,,jewelltaylorrr
1425,social distancing,"Niggas be like “oh you social distancing without me? What would you do if I was there?” ...die, wtf go away, no ???♂??",;;;,;;;,,Finnokin
1426,social distancing,McDonald's and other brands are making 'social distancing' logos - CNN,"McDonald's,CNN",McDonald's,,vincentfeltkamp
1427,social distancing,@asda ...disappointed to see senior management on TV this evening with a lack of reality. Today in portrack lane st…,TV;;,;;,,rkeenlyside
1428,social distancing,So helpful! Watch this and you'll understand how Coronavirus acts differently (and worse!) than the flu and why soc…,;Coronavirus;,;;,,AmandaKai8
1429,social distancing,Social distancing is easy when no one wants to get close to you.,,,,hotmessmama_2
1430,social distancing,"We should start to see whether the imposition of these rules, along with social distancing efforts by Albertans, ha…",Albertans,Albertans,,jasonfherring
1431,social distancing,@NSWBluesBrother @9_Moley They are doing a fantastic job under shocking conditions. However... Not only are they no…,;;;,;;;,,timmyr85
1432,social distancing,Nevada gets an A for social distancing READ MORE:,Nevada,Nevada,,reviewjournal
1433,social distancing,Hinshaw has said that it will take about two weeks for the impacts of social distancing measures to be reflected in…,Hinshaw,Hinshaw,,jasonfherring
1434,social distancing,"No need to stop by, keep that social distancing by utilizing our virtual tour we have provided for you! Reserve you…",;;,;;,,Crowneon10th
1435,social distancing,"@Oprah I remind everyone I speak with that we need to honor physical distancing, not social distancing. We are wir…",;;,;;,,jcuaubrey
1436,social distancing,"Me, making a wide berth around an old person: Social distancing, whoooooa!",,,,goingrampant
1437,social distancing,Guaranteed social distancing or your money back!,,,,wrongnowshutup2
1438,social distancing,Pls observe social distancing thank you,,,,mingyushalf
1439,social distancing,@CdnAgHRCouncil @NSFA @NACattleFeeders @eggsmanitoba @CFAFCA @jaitecsolutions Going into seeding especially how to…,,,,MysticShanyn
1440,social distancing,The governor said social distancing and there’s still 4 people in a $2 cab,,,,ShezusChrist
1441,social distancing,@SumYungGuy01 @ohxrat BRO YOURE BOOING BECAUSE I SAID STAY INSIDE AND FOLLOW SOCIAL DISTANCING RULES TO SAVE LIVES…,,,,PerfectlyLena
1442,social distancing,"@bbcquestiontime @richardhorton1 is this a joke?in times of ""social distancing""?(a term Gwynith Paltrow) would be e…",;Gwynith Paltrow;,;Gwynith Paltrow;,,nanabbatakari
1443,social distancing,"After 2 weeks of social distancing and eating my feelings, I couldn't be more ready for this present to myself to a…",,,,mpjeno
1444,social distancing,Spending more time at home while you practice social distancing? Ask a friend to join our campaign to…,;;,;;,,ARVotersFirst
1445,social distancing,"I feel like people are trying with the social distancing thing, but I am pretty sure Torontonians have NO clue how…",Torontonians,Torontonians,,benFsinger
1446,social distancing,@egoldie80 will you please tell the people to practice social distancing this virus have not reached its apex..my t…,,,,MainstreetPop
1447,social distancing,@sammacintoshho1 @sotonfcfan @spikedonline Oh come on. This is true social distancing! He is not likely to be of an…,;;;,;;;,,NONONOEU
1448,social distancing,@arthurslade I GUARANTEE mullets will help with social distancing.,,,,cenobyte
1449,social distancing,LEGO city #drone mapping activity coming soon. Learn what we’re up to at home while practicing social distancing.…,LEGO;;,LEGO;;,,citizen_gis
1450,social distancing,A scoreboard developed by a NYC-based data firm grades each state and county on how well its residents are practici…,,,,MidtownNYCPatch
1451,social distancing,"In crowded settings, is ORR able to follow the CDC’s guidance about social distancing and hygiene? Have they review…","ORR,CDC;;","ORR,CDC;;",,Kathryn_Opal
1452,social distancing,@BarW38 @Ghosts_Of_Me Well those who are not social distancing and taking the necessary precautions could in fact b…,,,,zver_cmzver
1453,social distancing,@realDonaldTrump I am begging you as a mother and grandmother please don't lessen the social distancing on this cou…,,,,DoriaAlberg
1454,social distancing,Eric Nam is wilding. Social distancing is getting to him ?,Eric Nam;;,Eric Nam;;,,honeyschoice10
1455,social distancing,Not sure how social distancing works? Check out this infographic. We all have a role to play and by working togethe…,;;;,;;;,,ROWPublicHealth
1456,social distancing,"Blackwell’s, my favourite place for book browsing ? I’ve always been amazed by their selection of high-quality text…",Blackwell’s;;,;;,,MissGSandford
1457,social distancing,"In an effort to provide more space for social distancing, the city is closing streets to cars starting Friday.",,,,WburgGptPatch
1458,social distancing,"@BigSugarShow Oh no! It’s not that bad here yet, I went today and it’s just a lot of people crowding together. Thro…",;;,;;,,MistressAnthea
1459,social distancing,3 Films That Will Make You Feel Better About Social Distancing ? and the Performances to Watch?,;;,;;,,GamezfuryL
1460,social distancing,How well are states social distancing? One start-up used cellphone data to try to measure it,;;,;;,,citizenherald
1461,social distancing,This social distancing shit cool when ya got your own place ?,,,,beyourdiamonds
1462,social distancing,Site H&S is a joke.. ladder and manual handling permits required before commencing work but not closing sites for b…,H&S;;,;;,,ConJamLan
1463,social distancing,@KayyKiss This shit is depressing! We gotta match soon to hell with social distancing lol,;;,;;,,MrFlightSkool
1464,social distancing,@MattWalshBlog Social distancing is working to curb the severity.,,,,PeggySC5
1465,social distancing,"@NikkiHaley Try to tell people about it when they have no NPR, no new television, art, music because of social dist…",NPR,,,basementvegan
1466,social distancing,"Trump previews new social distancing guidelines based on geographic risks Czar Trump I, yo…",Czar Trump,Czar Trump,,DijohltTy
1467,social distancing,"Social distancing is nearly impossible in #SierraLeone How do you lockdown if most people live hand to mouth and ""…",,,,ChadfromChad
1468,social distancing,Not sure if the bear was scared of me or just social distancing himself,,,,Ericmagnusson11
1469,social distancing,"It’s strange, never have dealt with this before. Typically I’d grab some friends, or go hang out at a crowded plac…",;;,;;,,TheOnlyRyann
1470,social distancing,Social Distancing (2020),,,,morvyie
1471,social distancing,Social distancing won't keep @UMMS from connecting with candidates. Check out their weekly virtual chats and upcomi…,;;,;;,,BrazenHQ
1472,social distancing,Shout out to Phillip Morris & the Kentucky Fried Chicken team in Elizabeth City... KBP Foods. We greatly appreciat…,"Phillip Morris,Kentucky Fried Chicken,Elizabeth City; KBP Foods;;","Phillip Morris,Kentucky Fried Chicken,Elizabeth City; KBP Foods;;",,ecpps
1473,social distancing,"Feel like since social distancing/lockdown started, I've been far more productive, far more physically active and i…",,,,Charlie_Mess
1474,social distancing,Everything Boris Johnson has done from economic measures to social distancing rules,Boris Johnson,Boris Johnson,,YahooNewsUK
1475,social distancing,This week’s Thumb Cramps was our first podcast recorded with social distancing! Give it a listen and let us know ho…,Thumb Cramps;;,Thumb Cramps;;,,SanspantsRadio
1476,social distancing,Literally everyone: Please stay inside and practice social distancing. My mom: Get out of the house for once.,;;,;;,,Luke_Powell_7
1477,social distancing,Social distancing! Be safe out there.,;;,;;,,khaigolfmaster
1478,social distancing,With this social distancing which one of the homies is trying to play striking vipers,,,,ericreddick
1479,social distancing,@NychelleX @coachdb181 @RealJamesWoods @kathygriffin @POTUS I don't wish the death of a loved one on anybody no mat…,,,,suppressedrep
1480,social distancing,"Of all times, why would you choose NOW to start excercising?? It's not social distancing if you go out to run and t…",;;,;;,,thecherrieberry
1481,social distancing,You wanna know why so many people are not social distancing? Remember that 1 in 8 men are comically bad at estimati…,;;,;;,,prfarlow
1482,social distancing,"@_ramone__ @lopcute Social distancing, empty streets, field hospitals, panic buying and self-isolation. Very eerie.",;;,;;,,sigwinch28
1483,social distancing,Here's my wife talking to her mum . Social Distancing I'm led to believe . I think we will stick with this arrangem…,;;;,;;;,,OurKarl
1484,social distancing,@ThatTimWalker @chellevesta Lots of social distancing in rural Nottinghamshire walks plus our village much applause for NHS staff at 8pm,"Nottinghamshire, NHS","Nottinghamshire, NHS",,sammons_pamela
1485,social distancing,@DrGJackBrown The Social Distancing Years,,,,techy_tellechea
1486,social distancing,"We can do this, Kentucky! Stay safe! Wash your hands! Practice social distancing! USE COMMON SENSE! #TeamKentucky…",Kentucky;;;;,Kentucky;;;;,,SplitKit
1487,social distancing,"While social distancing is a pain, and economically devastating for some, this is exactly why we do it and why we n…",,,,GeorgeVourlitis
1488,social distancing,@rollyhoyt @AsaHutchinson @SeemaCMS Meanwhile there is no social distancing at the human Development centers betwee…,,,,DCW4Arkansas
1489,social distancing,@itaintfacebook @johnbrogan @RealMarkLatham Remaining businesses are implementing sensible social distancing strate…,,,,abrashashapirus
1490,social distancing,Practicing social distancing....6 ft... FROM THE GROUND,,,,CoachGRich512
1491,social distancing,Bikes are good for social distancing and health ??,,,,itsneilb
1492,social distancing,"Day 9 of social distancing included Zoom meetings with his class, chalk science work, and missing Braves on opening…",Zoom,Zoom,,katiebarrieCCES
1493,social distancing,"In Africa, social distancing is a privilege few can afford @AJEnglish",Africa,Africa,,SolidarMed
1494,social distancing,"While the museum is closed, we wanted to remind all visitors and community members the importance of social distanc…",,,,umca_umass
1495,social distancing,To anyone scalping Ring Fit during social distancing in the hopes of making an extra hundred dollars?? Go fuck yourself.,Ring Fit;;,Ring Fit;;,,DigiAtlas
1496,social distancing,"@vanditvasan4 Also, sadly, Liverpool have 30 years of experience in social distancing, so we can wait a little longer.",Liverpool,Liverpool,,gauravshetts
1497,social distancing,Check out our ideas and resources for connecting and helping during social distancing #Covid19,,,,FSHDSociety
1498,social distancing,"The only way we can fight this deadly disease is to practice social distancing, sanitize your hands and wash your h…",,,,kikiPawon
1499,social distancing,@LauraPidcock @jeremycorbyn Social distancing,,,,nathan1harrison
1500,social distancing,#ESL it’s going to continue a lot lot higher. undervalued and business is super strong. “People will be eating in m…,;;;,;;;,,Touchthebutton1
1501,social distancing,Nice seeing all the streets out clapping but them high rise flats need fuckin ripping down you can't do social dist…,,,,cantankerousred
1502,social distancing,"@TimothyImholt But given the information we have, it's very likely that a significant portion of the population was…",,,,alc_anthro
1503,social distancing,@TheBabylonBee I call it social distancing from the Bible.,Bible,,,_Cranky_Pants
1504,social distancing,Map shows America's social distancing behavior state by state #FoxNews,America,America,,Patriot66874185
1505,social distancing,"While cases in Canada rise at a rate similar to the early days in Italy, people ignore the advice of our Provincial…","Canada,Italy","Canada,Italy",,TheMartlet
1506,social distancing,COVID-19: Communities rallying together while social distancing Small acts of kindness can…,COVID-19,,,TomLehner
1507,social distancing,Social distancing lol,,,,iamphaya
1508,social distancing,"Social-distancing while thesis-ing vlog, day 13: I really wasn't expecting this to happen (but honestly, I should…",,,,MelisaOlgun
1509,social distancing,"Social Distancing? You Might Be Fighting #ClimateChange , Too",;;,;;,,ReneOrij
1510,social distancing,"""Self-isolating and social distancing is not just to prevent yourself from catching the novel Coronavirus, but to h…",coronavirus,,,BC_Transplant
1511,social distancing,How long is social distancing supposed to last. My wife keeps trying to come into the house.,;;,;;,,DSR_F11
1512,social distancing,@adrianachechik Social distancing. I wish my dick was 6.5 ft long,;;,;;,,Samy_TheBull
1513,social distancing,@Puglaas @Starbucks @ArianaGrande Have you seen this story? Adjusting to #COVID2019 social distancing is not the s…,;;,;;,,deankalyan
1514,social distancing,@mallarchkrvrty1 @NMechawar @Brains_CAN @DouglasResearch @FdnDouglas Also in real life we practise much better social distancing,,,,Timothy_Bussey
1515,social distancing,"How so. Trump is urging social distancing to effectively end -- unless you think you can ""pack"" a church with every…",;Trump;,;Trump;,,daveblend
1516,social distancing,These seniors cope with social distancing by expressing their love for their country.,,,,alpha_maga
1517,social distancing,Social Distancing Day 8: Ahi Tuna Bowl! Insta: food4adventure #recipes #Cooking #chef #homeMade…,Tuna;;,;;,,shaq756
1518,social distancing,"@alexespind @JustinTrudeau I live in S.Ontario, neighbouring New York State, which is now considered the epicentre…","Ontario, New York","Ontario, New York",,Ferdinand_78
1519,social distancing,"We continue to urge Burque?os to #SupportLocalABQ businesses! Purchase gift cards, order delivery or carry-out, sho…",;;;,;;;,,CABQEconDev
1520,social distancing,Well I’m doing social distancing and I forget to say happy 314 day to my peeps in DA Lou!!! Got my drank n my cup!!!,;;,;;,,boogied_
1521,social distancing,@Tesco So where is your social distancing for the staff? Why are warehouses exempt from these rules. @piersmorgan,;;,;;,,Annaloveshome
1522,social distancing,Baseball Social Distancing 2020 #EAE.,Baseball,,,Baseballirmo
1523,social distancing,It’s funny watching telly dramas and films where there’s no social distancing. Those were the days... ??,;;,;;,,CllrCarpenter
1524,social distancing,Social Distancing isn't for everyone,,,,lnfinity
1525,social distancing,"During my run today, came across this sign reminding everyone to keep the social distancing while enjoying the Mill…",,,,pmumbower
1526,social distancing,@dondoroci This is beyond devastating and still most people fail to properly follow the recommendations to keep the…,,,,l_blende
1527,social distancing,"Hyderabad: No social distancing please, we're mantris ! #MinisterTSrinivasYadav #MinisterSrinivasGoud #Hyderabad…",,,,TheHansIndiaWeb
1528,social distancing,@RZChipMD @joshuy @CchristmColleen @MCarneyMD @wassdoc @EdithBu20999364 @liberman_tara @MartinsWelchMD…,,,,GIMaPreceptor
1529,social distancing,Recommended this morning in @BarackObama feed @TheAtlantic @edyong209 offers scenarios of f…,,,,lskube
1530,social distancing,Just wanted to check up on how social distancing been going for you. Wishing you didn’t block all my socials. I jus…,;;;,;;;,,GirardAmoyo
1531,social distancing,"@mishacollins some of SPN fans lost their jobs , my entire household. No $ relief in sight. NVR allow the governmen…",;;;,;;;,,Punchmonkey98
1532,social distancing,Feeling under the weather but trying to practice social distancing? We now offer telehealth! Contact us at 503-292-…,;;;,;;;,,GreenFieldPDX
1533,social distancing,"Social Distancing, People!!!",,,,abhorrent
1534,social distancing,@tomaspueyo @iHrithik @epigiri Equated with containment and what we are considering mitigation like lockdowns and…,,,,ash_rohatgi
1535,social distancing,@capellascp I don't want to give you the impression that his participation was voluntary lol This was a countable s…,,,,RandaleRichmond
1536,social distancing,"We miss our rugby and our socializing, but want to do our part to maintain social distancing. So, we're hosting a v…",;;,;;,,ClaytonRFC
1537,social distancing,"Artists You've Heard Before, What Social Distancing Looks Like For Them",,,,wvpublicnews
1538,social distancing,This social distancing thing is really stretching the limits of the social contract. How long will it be before the…,;;,;;,,DavidSheehan14
1539,social distancing,But let’s open all the doors. This has only been taken seriously for 16 days & look how man…,;;,;;,,JR_The_IrishMex
1540,social distancing,@blakebutler A new social distancing park?,,,,judyrchristman
1541,social distancing,@discordapp having esex with my girl so we can continue following the practice of social distancing,,,,iScenario
1542,social distancing,Just because we’re social distancing doesn’t mean we can’t keep the party going ? Catch @ryanskyy play live DJ sets…,;;,;;,,waldmgmt
1543,social distancing,"First real trip out of the house in a while to Canadian Blood Services. As a former recipient, I understand first…",;;,;;,,Overtired_Katie
1544,social distancing,Your child is going to have more screen time when you're social distancing: it's just going to happen. Try to make…,;;,;;,,wbensonpsyd
1545,social distancing,When fascism comes to America it will be wearing a lab coat preaching social distancing and handing out unemployment checks.,America,America,,SSchumpeter
1546,social distancing,Social distancing time is the only time hand holding is as inappropriate as anime makes it out to be.,,,,TimTheThird
1547,social distancing,"As you can see, the people are not engaging in proper social distancing, but at least the arcade cabs are 6 feet ap…",,,,AttractMode
1548,social distancing,@dprobbob There’s been a cruise ship sitting out in the Atlantic all day. Same spot bye the space center. Anyone kn…,Atlantic;;;,Atlantic;;;,,DebraLe99726880
1549,social distancing,@jani1881 @Mari_Knutson @stuartpstevens @CheriJacobus @RudyGiuliani Unfortunately they will add to deaths. Social…,;;,;;,,Peopleafteru
1550,social distancing,@realDonaldTrump The importance of social distancing and hand washing:,,,,CindyYob407
1551,social distancing,US to issue new risk-based social distancing guidelines Trump eager to ease restrictions on daily life designed to…,"US, Trump","US, Trump",,MJSMarkets
1552,social distancing,@MeetThePress @chucktodd Many American failed to social distance assuming that only applied to others. I still see…,American;;,American;;,,LIMAAB16
1553,social distancing,@vsknickemporium Not sure I'd be able to maintain social distancing rules ???,,,,Sir_sin0olyd99
1554,social distancing,"@vikingdrewby New order clarified it is allowed, social distancing rules apply.",,,,RLynch_OBJ
1555,social distancing,I know the roads are quieter but I have even found myself social distancing when I'm driving ?,,,,AndreaAndnorth
1556,social distancing,Worried #Ruddington residents are expressing concern still not everyone is taking enough notice of @PHE_uk‘s strict…,,,,RUDDINGTON_info
1557,social distancing,It’s kinda weird how good I’m getting to know myself over this whole social distancing thing. Maybe I should have t…,;;,;;,,masonjmessina
1558,social distancing,"In an effort to provide more space for social distancing, the city is closing streets to cars starting Friday.",,,,LES_Patch
1559,social distancing,"The coronavirus has spawned new words & phrases. -spatial co-presence (e.g., Karen had too much to drink and spat…",;;,;;,,okiequakey
1560,social distancing,"@savannah_rulez_ ""In my day, the only social distancing was from 2 dollar whores down by the docks - I didn't liste…",,,,skylightssounds
1561,social distancing,@llucygirll Golf is the epitome of social distancing. Do you know how golf works?,Golf;;,Golf;;,,atingwald
1562,social distancing,Does a snowball fight classify as social distancing? The weather and wet snow are perfect conditions and there a…,;;,;;,,mental_gas
1563,social distancing,At the end of social distancing,,,,MiyaNorfleet
1564,social distancing,New post: A Christian Moral and Theological Case for Social Distancing,Christian Moral,Christian Moral,,All_4Given
1565,social distancing,Revised: Don’t Let Social Distancing Stop You From Moving! -,,,,iTHRIVE_Plan
1566,social distancing,A Christian Moral and Theological Case for Social Distancing -,Christian Moral,Christian Moral,,ConnectByFaith
1567,social distancing,I take this very seriously. Practice social distancing. Stay away from the elderly and immune compromised. For…,;;;,;;;,,grimknowledge
1568,social distancing,Mood when the coronavirus & social distancing is finally over,,,,SPENNYjohn3
1569,social distancing,"@thehill @GOPLeader Ask yourself if the GOP is there for you today, tomorrow and the day after when you cannot get…",GOP,GOP,,ClaudineJ18
1570,social distancing,"Too many candles on the BDay cake, pallet. Social distancing requires heat. Many a BTU baby. #firepitlife",;;BTU;,;;BTU;,,PKibble
1571,social distancing,Kijiji Autos is supporting dealers with a 100% discount on listings and features through April. Take advantage! Ki…,Kijiji Autos;;,Kijiji Autos;;,,thecargirls
1572,social distancing,"In an effort to provide more space for social distancing, the city is closing streets to cars starting Friday.",,,,BedStuyPatch
1573,social distancing,"With his Covid response, and now his desire to ease social distancing in parts of the country, despite all medical…",Covid,,,nikpalch
1574,social distancing,There really haven’t been enough drugs involved in this social distancing/self isolation situation,,,,_Down2Mars
1575,social distancing,I’ll wait until all this boa over before I ever go back to @Target! @costco & @StopandShop are practicing social di…,;;,;;,,StunnerJ
1576,social distancing,A scoreboard developed by a NYC-based data firm grades each state and county on how well its residents are practici…,,,,BedStuyPatch
1577,social distancing,@JPD2503 @piersmorgan @RobertJenrick I’m sorry to hear that. As long as we keep working and travel to and from work…,;;,;;,,jmconnor6
1578,social distancing,@whmpeg we gonna have a joint social distancing dance party? ??,,,,t_ninjaa
1579,social distancing,@gwasserst I can't wait for the dog pile the moment we're allowed to stop social distancing,,,,littleladymab
1580,social distancing,I’m stuck in a really toxic situation and I fear for my well being but I can’t leave bc I don’t want to break social distancing aha,,,,xgalpalvalx
1581,social distancing,Ngl social distancing has me very lonely,,,,MechaVX
1582,social distancing,@ContentNBA Social Distancing,,,,_smh24_
1583,social distancing,Day... whatever ... of social distancing / staying home,,,,EmmySue132
1584,social distancing,this quarantine shit betta finish itself by @jodesnguyen 20th bday bc how tf imma make her black if social distancing a thing...,,,,aoxchris_
1585,social distancing,@jeremypgordon i said something the first day he started social distancing because i immediately identified that it…,,,,kelibacy
